"No.","Time","Source","Destination","Protocol","Length","Info"
"70","9.677788482","127.0.0.1","127.0.0.1","TCP","74","59240  >  443 [SYN] Seq=0 Win=65495 Len=0 MSS=65495 SACK_PERM=1 TSval=3258459123 TSecr=0 WS=128"
"71","9.677794923","127.0.0.1","127.0.0.1","TCP","54","443  >  59240 [RST, ACK] Seq=1 Ack=1 Win=0 Len=0"
"95","13.367442144","127.0.0.1","127.0.0.1","TCP","74","33704  >  8080 [SYN] Seq=0 Win=65495 Len=0 MSS=65495 SACK_PERM=1 TSval=3258462813 TSecr=0 WS=128"
"96","13.367457354","127.0.0.1","127.0.0.1","TCP","74","8080  >  33704 [SYN, ACK] Seq=0 Ack=1 Win=65483 Len=0 MSS=65495 SACK_PERM=1 TSval=3258462813 TSecr=3258462813 WS=128"
"97","13.367466351","127.0.0.1","127.0.0.1","TCP","66","33704  >  8080 [ACK] Seq=1 Ack=1 Win=65536 Len=0 TSval=3258462813 TSecr=3258462813"
"98","13.367575207","127.0.0.1","127.0.0.1","TCP","85","8080  >  33704 [PSH, ACK] Seq=1 Ack=1 Win=65536 Len=19 TSval=3258462813 TSecr=3258462813 [TCP segment of a reassembled PDU]"
"99","13.367602837","127.0.0.1","127.0.0.1","TCP","66","33704  >  8080 [ACK] Seq=1 Ack=20 Win=65536 Len=0 TSval=3258462813 TSecr=3258462813"
"100","13.367771231","127.0.0.1","127.0.0.1","TCP","84","33704  >  8080 [PSH, ACK] Seq=1 Ack=20 Win=65536 Len=18 TSval=3258462813 TSecr=3258462813 [TCP segment of a reassembled PDU]"
"101","13.367776238","127.0.0.1","127.0.0.1","TCP","66","8080  >  33704 [ACK] Seq=20 Ack=19 Win=65536 Len=0 TSval=3258462813 TSecr=3258462813"
"102","16.783339553","127.0.0.1","127.0.0.1","TCP","74","33706  >  8080 [SYN] Seq=0 Win=65495 Len=0 MSS=65495 SACK_PERM=1 TSval=3258466229 TSecr=0 WS=128"
"103","16.783354727","127.0.0.1","127.0.0.1","TCP","74","8080  >  33706 [SYN, ACK] Seq=0 Ack=1 Win=65483 Len=0 MSS=65495 SACK_PERM=1 TSval=3258466229 TSecr=3258466229 WS=128"
"104","16.783363671","127.0.0.1","127.0.0.1","TCP","66","33706  >  8080 [ACK] Seq=1 Ack=1 Win=65536 Len=0 TSval=3258466229 TSecr=3258466229"
"105","16.783466908","127.0.0.1","127.0.0.1","TCP","85","8080  >  33706 [PSH, ACK] Seq=1 Ack=1 Win=65536 Len=19 TSval=3258466229 TSecr=3258466229 [TCP segment of a reassembled PDU]"
"106","16.783493772","127.0.0.1","127.0.0.1","TCP","66","33706  >  8080 [ACK] Seq=1 Ack=20 Win=65536 Len=0 TSval=3258466229 TSecr=3258466229"
"107","16.783653358","127.0.0.1","127.0.0.1","TCP","84","33706  >  8080 [PSH, ACK] Seq=1 Ack=20 Win=65536 Len=18 TSval=3258466229 TSecr=3258466229 [TCP segment of a reassembled PDU]"
"108","16.783658284","127.0.0.1","127.0.0.1","TCP","66","8080  >  33706 [ACK] Seq=20 Ack=19 Win=65536 Len=0 TSval=3258466229 TSecr=3258466229"
"109","21.071439331","127.0.0.1","127.0.0.1","TCP","74","33708  >  8080 [SYN] Seq=0 Win=65495 Len=0 MSS=65495 SACK_PERM=1 TSval=3258470517 TSecr=0 WS=128"
"110","21.071450450","127.0.0.1","127.0.0.1","TCP","74","8080  >  33708 [SYN, ACK] Seq=0 Ack=1 Win=65483 Len=0 MSS=65495 SACK_PERM=1 TSval=3258470517 TSecr=3258470517 WS=128"
"111","21.071459117","127.0.0.1","127.0.0.1","TCP","66","33708  >  8080 [ACK] Seq=1 Ack=1 Win=65536 Len=0 TSval=3258470517 TSecr=3258470517"
"112","21.071582167","127.0.0.1","127.0.0.1","TCP","85","8080  >  33708 [PSH, ACK] Seq=1 Ack=1 Win=65536 Len=19 TSval=3258470517 TSecr=3258470517 [TCP segment of a reassembled PDU]"
"113","21.071607770","127.0.0.1","127.0.0.1","TCP","66","33708  >  8080 [ACK] Seq=1 Ack=20 Win=65536 Len=0 TSval=3258470517 TSecr=3258470517"
"114","21.071756288","127.0.0.1","127.0.0.1","TCP","84","33708  >  8080 [PSH, ACK] Seq=1 Ack=20 Win=65536 Len=18 TSval=3258470517 TSecr=3258470517 [TCP segment of a reassembled PDU]"
"115","21.071760840","127.0.0.1","127.0.0.1","TCP","66","8080  >  33708 [ACK] Seq=20 Ack=19 Win=65536 Len=0 TSval=3258470517 TSecr=3258470517"
"116","24.846456513","127.0.0.1","127.0.0.1","TCP","67","33704  >  8080 [PSH, ACK] Seq=19 Ack=20 Win=65536 Len=1 TSval=3258474292 TSecr=3258462813 [TCP segment of a reassembled PDU]"
"117","24.846487693","127.0.0.1","127.0.0.1","TCP","66","8080  >  33704 [ACK] Seq=20 Ack=20 Win=65536 Len=0 TSval=3258474292 TSecr=3258474292"
"118","24.851847672","127.0.0.1","127.0.0.1","TCP","82","8080  >  33704 [PSH, ACK] Seq=20 Ack=20 Win=65536 Len=16 TSval=3258474297 TSecr=3258474292 [TCP segment of a reassembled PDU]"
"119","24.851855457","127.0.0.1","127.0.0.1","TCP","66","33704  >  8080 [ACK] Seq=20 Ack=36 Win=65536 Len=0 TSval=3258474297 TSecr=3258474297"
"120","24.851985099","127.0.0.1","127.0.0.1","TCP","74","33704  >  8080 [PSH, ACK] Seq=20 Ack=36 Win=65536 Len=8 TSval=3258474297 TSecr=3258474297 [TCP segment of a reassembled PDU]"
"121","24.851989921","127.0.0.1","127.0.0.1","TCP","66","8080  >  33704 [ACK] Seq=36 Ack=28 Win=65536 Len=0 TSval=3258474297 TSecr=3258474297"
"122","24.852065556","127.0.0.1","127.0.0.1","TCP","89","8080  >  33704 [PSH, ACK] Seq=36 Ack=28 Win=65536 Len=23 TSval=3258474297 TSecr=3258474297 [TCP segment of a reassembled PDU]"
"123","24.852070617","127.0.0.1","127.0.0.1","TCP","66","33704  >  8080 [ACK] Seq=28 Ack=59 Win=65536 Len=0 TSval=3258474297 TSecr=3258474297"
"124","24.852149988","127.0.0.1","127.0.0.1","TCP","74","33704  >  8080 [PSH, ACK] Seq=28 Ack=59 Win=65536 Len=8 TSval=3258474297 TSecr=3258474297 [TCP segment of a reassembled PDU]"
"125","24.852154466","127.0.0.1","127.0.0.1","TCP","66","8080  >  33704 [ACK] Seq=59 Ack=36 Win=65536 Len=0 TSval=3258474297 TSecr=3258474297"
"126","24.852202985","127.0.0.1","127.0.0.1","TCP","86","8080  >  33704 [PSH, ACK] Seq=59 Ack=36 Win=65536 Len=20 TSval=3258474297 TSecr=3258474297 [TCP segment of a reassembled PDU]"
"127","24.852206662","127.0.0.1","127.0.0.1","TCP","66","33704  >  8080 [ACK] Seq=36 Ack=79 Win=65536 Len=0 TSval=3258474297 TSecr=3258474297"
"128","24.852249170","127.0.0.1","127.0.0.1","TCP","74","33704  >  8080 [PSH, ACK] Seq=36 Ack=79 Win=65536 Len=8 TSval=3258474297 TSecr=3258474297 [TCP segment of a reassembled PDU]"
"129","24.852251923","127.0.0.1","127.0.0.1","TCP","66","8080  >  33704 [ACK] Seq=79 Ack=44 Win=65536 Len=0 TSval=3258474298 TSecr=3258474297"
"130","24.852312912","127.0.0.1","127.0.0.1","TCP","80","8080  >  33704 [PSH, ACK] Seq=79 Ack=44 Win=65536 Len=14 TSval=3258474298 TSecr=3258474297 [TCP segment of a reassembled PDU]"
"131","24.852316636","127.0.0.1","127.0.0.1","TCP","66","33704  >  8080 [ACK] Seq=44 Ack=93 Win=65536 Len=0 TSval=3258474298 TSecr=3258474298"
"132","24.852360888","127.0.0.1","127.0.0.1","TCP","74","33704  >  8080 [PSH, ACK] Seq=44 Ack=93 Win=65536 Len=8 TSval=3258474298 TSecr=3258474298 [TCP segment of a reassembled PDU]"
"133","24.852364352","127.0.0.1","127.0.0.1","TCP","66","8080  >  33704 [ACK] Seq=93 Ack=52 Win=65536 Len=0 TSval=3258474298 TSecr=3258474298"
"134","24.856746485","127.0.0.1","127.0.0.1","TCP","126","33704  >  8080 [PSH, ACK] Seq=52 Ack=93 Win=65536 Len=60 TSval=3258474302 TSecr=3258474298"
"135","24.856752039","127.0.0.1","127.0.0.1","TCP","66","8080  >  33704 [ACK] Seq=93 Ack=112 Win=65536 Len=0 TSval=3258474302 TSecr=3258474302"
"136","28.814488155","127.0.0.1","127.0.0.1","TCP","67","33706  >  8080 [PSH, ACK] Seq=19 Ack=20 Win=65536 Len=1 TSval=3258478260 TSecr=3258466229 [TCP segment of a reassembled PDU]"
"137","28.814502756","127.0.0.1","127.0.0.1","TCP","66","8080  >  33706 [ACK] Seq=20 Ack=20 Win=65536 Len=0 TSval=3258478260 TSecr=3258478260"
"138","28.819433290","127.0.0.1","127.0.0.1","TCP","89","8080  >  33706 [PSH, ACK] Seq=20 Ack=20 Win=65536 Len=23 TSval=3258478265 TSecr=3258478260 [TCP segment of a reassembled PDU]"
"139","28.819439648","127.0.0.1","127.0.0.1","TCP","66","33706  >  8080 [ACK] Seq=20 Ack=43 Win=65536 Len=0 TSval=3258478265 TSecr=3258478265"
"140","28.819567962","127.0.0.1","127.0.0.1","TCP","74","33706  >  8080 [PSH, ACK] Seq=20 Ack=43 Win=65536 Len=8 TSval=3258478265 TSecr=3258478265 [TCP segment of a reassembled PDU]"
"141","28.819572689","127.0.0.1","127.0.0.1","TCP","66","8080  >  33706 [ACK] Seq=43 Ack=28 Win=65536 Len=0 TSval=3258478265 TSecr=3258478265"
"142","28.819684824","127.0.0.1","127.0.0.1","TCP","86","8080  >  33706 [PSH, ACK] Seq=43 Ack=28 Win=65536 Len=20 TSval=3258478265 TSecr=3258478265 [TCP segment of a reassembled PDU]"
"143","28.819689443","127.0.0.1","127.0.0.1","TCP","66","33706  >  8080 [ACK] Seq=28 Ack=63 Win=65536 Len=0 TSval=3258478265 TSecr=3258478265"
"144","28.819726040","127.0.0.1","127.0.0.1","TCP","74","33706  >  8080 [PSH, ACK] Seq=28 Ack=63 Win=65536 Len=8 TSval=3258478265 TSecr=3258478265 [TCP segment of a reassembled PDU]"
"145","28.819729353","127.0.0.1","127.0.0.1","TCP","66","8080  >  33706 [ACK] Seq=63 Ack=36 Win=65536 Len=0 TSval=3258478265 TSecr=3258478265"
"146","28.824439044","127.0.0.1","127.0.0.1","TCP","126","33706  >  8080 [PSH, ACK] Seq=36 Ack=63 Win=65536 Len=60 TSval=3258478270 TSecr=3258478265"
"147","28.824447292","127.0.0.1","127.0.0.1","TCP","66","8080  >  33706 [ACK] Seq=63 Ack=96 Win=65536 Len=0 TSval=3258478270 TSecr=3258478270"
"148","34.158439879","127.0.0.1","127.0.0.1","TCP","67","33708  >  8080 [PSH, ACK] Seq=19 Ack=20 Win=65536 Len=1 TSval=3258483604 TSecr=3258470517 [TCP segment of a reassembled PDU]"
"149","34.158470819","127.0.0.1","127.0.0.1","TCP","66","8080  >  33708 [ACK] Seq=20 Ack=20 Win=65536 Len=0 TSval=3258483604 TSecr=3258483604"
"150","34.163685505","127.0.0.1","127.0.0.1","TCP","82","8080  >  33708 [PSH, ACK] Seq=20 Ack=20 Win=65536 Len=16 TSval=3258483609 TSecr=3258483604 [TCP segment of a reassembled PDU]"
"151","34.163692665","127.0.0.1","127.0.0.1","TCP","66","33708  >  8080 [ACK] Seq=20 Ack=36 Win=65536 Len=0 TSval=3258483609 TSecr=3258483609"
"152","34.163804673","127.0.0.1","127.0.0.1","TCP","74","33708  >  8080 [PSH, ACK] Seq=20 Ack=36 Win=65536 Len=8 TSval=3258483609 TSecr=3258483609 [TCP segment of a reassembled PDU]"
"153","34.163809351","127.0.0.1","127.0.0.1","TCP","66","8080  >  33708 [ACK] Seq=36 Ack=28 Win=65536 Len=0 TSval=3258483609 TSecr=3258483609"
"154","34.163860791","127.0.0.1","127.0.0.1","TCP","89","8080  >  33708 [PSH, ACK] Seq=36 Ack=28 Win=65536 Len=23 TSval=3258483609 TSecr=3258483609 [TCP segment of a reassembled PDU]"
"155","34.163863568","127.0.0.1","127.0.0.1","TCP","66","33708  >  8080 [ACK] Seq=28 Ack=59 Win=65536 Len=0 TSval=3258483609 TSecr=3258483609"
"156","34.163901435","127.0.0.1","127.0.0.1","TCP","74","33708  >  8080 [PSH, ACK] Seq=28 Ack=59 Win=65536 Len=8 TSval=3258483609 TSecr=3258483609 [TCP segment of a reassembled PDU]"
"157","34.163903890","127.0.0.1","127.0.0.1","TCP","66","8080  >  33708 [ACK] Seq=59 Ack=36 Win=65536 Len=0 TSval=3258483609 TSecr=3258483609"
"158","34.163969393","127.0.0.1","127.0.0.1","TCP","88","8080  >  33708 [PSH, ACK] Seq=59 Ack=36 Win=65536 Len=22 TSval=3258483609 TSecr=3258483609 [TCP segment of a reassembled PDU]"
"159","34.163974258","127.0.0.1","127.0.0.1","TCP","66","33708  >  8080 [ACK] Seq=36 Ack=81 Win=65536 Len=0 TSval=3258483609 TSecr=3258483609"
"160","34.164021197","127.0.0.1","127.0.0.1","TCP","74","33708  >  8080 [PSH, ACK] Seq=36 Ack=81 Win=65536 Len=8 TSval=3258483609 TSecr=3258483609 [TCP segment of a reassembled PDU]"
"161","34.164024978","127.0.0.1","127.0.0.1","TCP","66","8080  >  33708 [ACK] Seq=81 Ack=44 Win=65536 Len=0 TSval=3258483609 TSecr=3258483609"
"162","34.164078469","127.0.0.1","127.0.0.1","TCP","86","8080  >  33708 [PSH, ACK] Seq=81 Ack=44 Win=65536 Len=20 TSval=3258483609 TSecr=3258483609 [TCP segment of a reassembled PDU]"
"163","34.164081071","127.0.0.1","127.0.0.1","TCP","66","33708  >  8080 [ACK] Seq=44 Ack=101 Win=65536 Len=0 TSval=3258483609 TSecr=3258483609"
"164","34.164117828","127.0.0.1","127.0.0.1","TCP","74","33708  >  8080 [PSH, ACK] Seq=44 Ack=101 Win=65536 Len=8 TSval=3258483609 TSecr=3258483609 [TCP segment of a reassembled PDU]"
"165","34.164120415","127.0.0.1","127.0.0.1","TCP","66","8080  >  33708 [ACK] Seq=101 Ack=52 Win=65536 Len=0 TSval=3258483609 TSecr=3258483609"
"166","34.164166332","127.0.0.1","127.0.0.1","TCP","80","8080  >  33708 [PSH, ACK] Seq=101 Ack=52 Win=65536 Len=14 TSval=3258483609 TSecr=3258483609 [TCP segment of a reassembled PDU]"
"167","34.164168991","127.0.0.1","127.0.0.1","TCP","66","33708  >  8080 [ACK] Seq=52 Ack=115 Win=65536 Len=0 TSval=3258483609 TSecr=3258483609"
"168","34.164229783","127.0.0.1","127.0.0.1","TCP","74","33708  >  8080 [PSH, ACK] Seq=52 Ack=115 Win=65536 Len=8 TSval=3258483609 TSecr=3258483609 [TCP segment of a reassembled PDU]"
"169","34.164234803","127.0.0.1","127.0.0.1","TCP","66","8080  >  33708 [ACK] Seq=115 Ack=60 Win=65536 Len=0 TSval=3258483609 TSecr=3258483609"
"170","34.164293545","127.0.0.1","127.0.0.1","TCP","80","8080  >  33708 [PSH, ACK] Seq=115 Ack=60 Win=65536 Len=14 TSval=3258483610 TSecr=3258483609 [TCP segment of a reassembled PDU]"
"171","34.164296571","127.0.0.1","127.0.0.1","TCP","66","33708  >  8080 [ACK] Seq=60 Ack=129 Win=65536 Len=0 TSval=3258483610 TSecr=3258483610"
"172","34.164403402","127.0.0.1","127.0.0.1","TCP","74","33708  >  8080 [PSH, ACK] Seq=60 Ack=129 Win=65536 Len=8 TSval=3258483610 TSecr=3258483610 [TCP segment of a reassembled PDU]"
"173","34.164407929","127.0.0.1","127.0.0.1","TCP","66","8080  >  33708 [ACK] Seq=129 Ack=68 Win=65536 Len=0 TSval=3258483610 TSecr=3258483610"
"174","34.168945359","127.0.0.1","127.0.0.1","TCP","126","33708  >  8080 [PSH, ACK] Seq=68 Ack=129 Win=65536 Len=60 TSval=3258483614 TSecr=3258483610"
"175","34.168951605","127.0.0.1","127.0.0.1","TCP","66","8080  >  33708 [ACK] Seq=129 Ack=128 Win=65536 Len=0 TSval=3258483614 TSecr=3258483614"
"180","44.857142624","127.0.0.1","127.0.0.1","TCP","89","8080  >  33704 [PSH, ACK] Seq=93 Ack=112 Win=65536 Len=23 TSval=3258494302 TSecr=3258474302 [TCP segment of a reassembled PDU]"
"181","44.857170667","127.0.0.1","127.0.0.1","TCP","66","33704  >  8080 [ACK] Seq=112 Ack=116 Win=65536 Len=0 TSval=3258494302 TSecr=3258494302"
"182","44.857651668","127.0.0.1","127.0.0.1","TCP","66","33704  >  8080 [FIN, ACK] Seq=112 Ack=116 Win=65536 Len=0 TSval=3258494303 TSecr=3258494302"
"183","44.898738482","127.0.0.1","127.0.0.1","TCP","66","8080  >  33704 [ACK] Seq=116 Ack=113 Win=65536 Len=0 TSval=3258494344 TSecr=3258494303"
"260","45.667027222","127.0.0.1","127.0.0.1","TCP","74","59278  >  443 [SYN] Seq=0 Win=65495 Len=0 MSS=65495 SACK_PERM=1 TSval=3258495112 TSecr=0 WS=128"
"261","45.667032314","127.0.0.1","127.0.0.1","TCP","54","443  >  59278 [RST, ACK] Seq=1 Ack=1 Win=0 Len=0"
"284","48.825004035","127.0.0.1","127.0.0.1","TCP","89","8080  >  33706 [PSH, ACK] Seq=63 Ack=96 Win=65536 Len=23 TSval=3258498270 TSecr=3258478270 [TCP segment of a reassembled PDU]"
"285","48.825061428","127.0.0.1","127.0.0.1","TCP","66","33706  >  8080 [ACK] Seq=96 Ack=86 Win=65536 Len=0 TSval=3258498270 TSecr=3258498270"
"286","48.825515066","127.0.0.1","127.0.0.1","TCP","66","33706  >  8080 [FIN, ACK] Seq=96 Ack=86 Win=65536 Len=0 TSval=3258498271 TSecr=3258498270"
"287","48.866793371","127.0.0.1","127.0.0.1","TCP","66","8080  >  33706 [ACK] Seq=86 Ack=97 Win=65536 Len=0 TSval=3258498312 TSecr=3258498271"
"292","54.169304972","127.0.0.1","127.0.0.1","TCP","89","8080  >  33708 [PSH, ACK] Seq=129 Ack=128 Win=65536 Len=23 TSval=3258503615 TSecr=3258483614 [TCP segment of a reassembled PDU]"
"293","54.169332558","127.0.0.1","127.0.0.1","TCP","66","33708  >  8080 [ACK] Seq=128 Ack=152 Win=65536 Len=0 TSval=3258503615 TSecr=3258503615"
"294","54.169818438","127.0.0.1","127.0.0.1","TCP","66","33708  >  8080 [FIN, ACK] Seq=128 Ack=152 Win=65536 Len=0 TSval=3258503615 TSecr=3258503615"
"295","54.210268225","127.0.0.1","127.0.0.1","TCP","66","8080  >  33708 [ACK] Seq=152 Ack=129 Win=65536 Len=0 TSval=3258503656 TSecr=3258503615"
"296","59.167157373","127.0.0.1","127.0.0.1","TCP","74","33738  >  8080 [SYN] Seq=0 Win=65495 Len=0 MSS=65495 SACK_PERM=1 TSval=3258508612 TSecr=0 WS=128"
"297","59.167168322","127.0.0.1","127.0.0.1","TCP","74","8080  >  33738 [SYN, ACK] Seq=0 Ack=1 Win=65483 Len=0 MSS=65495 SACK_PERM=1 TSval=3258508612 TSecr=3258508612 WS=128"
"298","59.167177275","127.0.0.1","127.0.0.1","TCP","66","33738  >  8080 [ACK] Seq=1 Ack=1 Win=65536 Len=0 TSval=3258508612 TSecr=3258508612"
"299","59.167283693","127.0.0.1","127.0.0.1","TCP","85","8080  >  33738 [PSH, ACK] Seq=1 Ack=1 Win=65536 Len=19 TSval=3258508613 TSecr=3258508612 [TCP segment of a reassembled PDU]"
"300","59.167312560","127.0.0.1","127.0.0.1","TCP","66","33738  >  8080 [ACK] Seq=1 Ack=20 Win=65536 Len=0 TSval=3258508613 TSecr=3258508613"
"301","59.167460261","127.0.0.1","127.0.0.1","TCP","84","33738  >  8080 [PSH, ACK] Seq=1 Ack=20 Win=65536 Len=18 TSval=3258508613 TSecr=3258508613 [TCP segment of a reassembled PDU]"
"302","59.167465268","127.0.0.1","127.0.0.1","TCP","66","8080  >  33738 [ACK] Seq=20 Ack=19 Win=65536 Len=0 TSval=3258508613 TSecr=3258508613"
"307","65.374351934","127.0.0.1","127.0.0.1","TCP","67","33738  >  8080 [PSH, ACK] Seq=19 Ack=20 Win=65536 Len=1 TSval=3258514820 TSecr=3258508613 [TCP segment of a reassembled PDU]"
"308","65.374406261","127.0.0.1","127.0.0.1","TCP","66","8080  >  33738 [ACK] Seq=20 Ack=20 Win=65536 Len=0 TSval=3258514820 TSecr=3258514820"
"309","65.378961113","127.0.0.1","127.0.0.1","TCP","82","8080  >  33738 [PSH, ACK] Seq=20 Ack=20 Win=65536 Len=16 TSval=3258514824 TSecr=3258514820 [TCP segment of a reassembled PDU]"
"310","65.378982344","127.0.0.1","127.0.0.1","TCP","66","33738  >  8080 [ACK] Seq=20 Ack=36 Win=65536 Len=0 TSval=3258514824 TSecr=3258514824"
"311","65.379066785","127.0.0.1","127.0.0.1","TCP","74","33738  >  8080 [PSH, ACK] Seq=20 Ack=36 Win=65536 Len=8 TSval=3258514824 TSecr=3258514824 [TCP segment of a reassembled PDU]"
"312","65.379070798","127.0.0.1","127.0.0.1","TCP","66","8080  >  33738 [ACK] Seq=36 Ack=28 Win=65536 Len=0 TSval=3258514824 TSecr=3258514824"
"313","65.379120142","127.0.0.1","127.0.0.1","TCP","89","8080  >  33738 [PSH, ACK] Seq=36 Ack=28 Win=65536 Len=23 TSval=3258514824 TSecr=3258514824 [TCP segment of a reassembled PDU]"
"314","65.379123433","127.0.0.1","127.0.0.1","TCP","66","33738  >  8080 [ACK] Seq=28 Ack=59 Win=65536 Len=0 TSval=3258514824 TSecr=3258514824"
"315","65.379261048","127.0.0.1","127.0.0.1","TCP","74","33738  >  8080 [PSH, ACK] Seq=28 Ack=59 Win=65536 Len=8 TSval=3258514825 TSecr=3258514824 [TCP segment of a reassembled PDU]"
"316","65.379265334","127.0.0.1","127.0.0.1","TCP","66","8080  >  33738 [ACK] Seq=59 Ack=36 Win=65536 Len=0 TSval=3258514825 TSecr=3258514825"
"317","65.379396072","127.0.0.1","127.0.0.1","TCP","86","8080  >  33738 [PSH, ACK] Seq=59 Ack=36 Win=65536 Len=20 TSval=3258514825 TSecr=3258514825 [TCP segment of a reassembled PDU]"
"318","65.379399938","127.0.0.1","127.0.0.1","TCP","66","33738  >  8080 [ACK] Seq=36 Ack=79 Win=65536 Len=0 TSval=3258514825 TSecr=3258514825"
"319","65.379501419","127.0.0.1","127.0.0.1","TCP","74","33738  >  8080 [PSH, ACK] Seq=36 Ack=79 Win=65536 Len=8 TSval=3258514825 TSecr=3258514825 [TCP segment of a reassembled PDU]"
"320","65.379504208","127.0.0.1","127.0.0.1","TCP","66","8080  >  33738 [ACK] Seq=79 Ack=44 Win=65536 Len=0 TSval=3258514825 TSecr=3258514825"
"321","65.383794852","127.0.0.1","127.0.0.1","TCP","126","33738  >  8080 [PSH, ACK] Seq=44 Ack=79 Win=65536 Len=60 TSval=3258514829 TSecr=3258514825"
"322","65.383800896","127.0.0.1","127.0.0.1","TCP","66","8080  >  33738 [ACK] Seq=79 Ack=104 Win=65536 Len=0 TSval=3258514829 TSecr=3258514829"
"323","67.551062454","127.0.0.1","127.0.0.1","TCP","74","33740  >  8080 [SYN] Seq=0 Win=65495 Len=0 MSS=65495 SACK_PERM=1 TSval=3258516996 TSecr=0 WS=128"
"324","67.551073166","127.0.0.1","127.0.0.1","TCP","74","8080  >  33740 [SYN, ACK] Seq=0 Ack=1 Win=65483 Len=0 MSS=65495 SACK_PERM=1 TSval=3258516996 TSecr=3258516996 WS=128"
"325","67.551082089","127.0.0.1","127.0.0.1","TCP","66","33740  >  8080 [ACK] Seq=1 Ack=1 Win=65536 Len=0 TSval=3258516996 TSecr=3258516996"
"326","67.551178551","127.0.0.1","127.0.0.1","TCP","85","8080  >  33740 [PSH, ACK] Seq=1 Ack=1 Win=65536 Len=19 TSval=3258516996 TSecr=3258516996 [TCP segment of a reassembled PDU]"
"327","67.551205477","127.0.0.1","127.0.0.1","TCP","66","33740  >  8080 [ACK] Seq=1 Ack=20 Win=65536 Len=0 TSval=3258516996 TSecr=3258516996"
"328","67.551369894","127.0.0.1","127.0.0.1","TCP","84","33740  >  8080 [PSH, ACK] Seq=1 Ack=20 Win=65536 Len=18 TSval=3258516997 TSecr=3258516996 [TCP segment of a reassembled PDU]"
"329","67.551374919","127.0.0.1","127.0.0.1","TCP","66","8080  >  33740 [ACK] Seq=20 Ack=19 Win=65536 Len=0 TSval=3258516997 TSecr=3258516997"
"330","69.847061346","127.0.0.1","127.0.0.1","TCP","74","33742  >  8080 [SYN] Seq=0 Win=65495 Len=0 MSS=65495 SACK_PERM=1 TSval=3258519292 TSecr=0 WS=128"
"331","69.847072250","127.0.0.1","127.0.0.1","TCP","74","8080  >  33742 [SYN, ACK] Seq=0 Ack=1 Win=65483 Len=0 MSS=65495 SACK_PERM=1 TSval=3258519292 TSecr=3258519292 WS=128"
"332","69.847081134","127.0.0.1","127.0.0.1","TCP","66","33742  >  8080 [ACK] Seq=1 Ack=1 Win=65536 Len=0 TSval=3258519292 TSecr=3258519292"
"333","69.847183354","127.0.0.1","127.0.0.1","TCP","85","8080  >  33742 [PSH, ACK] Seq=1 Ack=1 Win=65536 Len=19 TSval=3258519292 TSecr=3258519292 [TCP segment of a reassembled PDU]"
"334","69.847210056","127.0.0.1","127.0.0.1","TCP","66","33742  >  8080 [ACK] Seq=1 Ack=20 Win=65536 Len=0 TSval=3258519292 TSecr=3258519292"
"335","69.847355713","127.0.0.1","127.0.0.1","TCP","84","33742  >  8080 [PSH, ACK] Seq=1 Ack=20 Win=65536 Len=18 TSval=3258519293 TSecr=3258519292 [TCP segment of a reassembled PDU]"
"336","69.847360314","127.0.0.1","127.0.0.1","TCP","66","8080  >  33742 [ACK] Seq=20 Ack=19 Win=65536 Len=0 TSval=3258519293 TSecr=3258519293"
"337","71.550484042","127.0.0.1","127.0.0.1","TCP","67","33742  >  8080 [PSH, ACK] Seq=19 Ack=20 Win=65536 Len=1 TSval=3258520996 TSecr=3258519293 [TCP segment of a reassembled PDU]"
"338","71.550497344","127.0.0.1","127.0.0.1","TCP","66","8080  >  33742 [ACK] Seq=20 Ack=20 Win=65536 Len=0 TSval=3258520996 TSecr=3258520996"
"339","71.555620539","127.0.0.1","127.0.0.1","TCP","89","8080  >  33742 [PSH, ACK] Seq=20 Ack=20 Win=65536 Len=23 TSval=3258521001 TSecr=3258520996 [TCP segment of a reassembled PDU]"
"340","71.555628247","127.0.0.1","127.0.0.1","TCP","66","33742  >  8080 [ACK] Seq=20 Ack=43 Win=65536 Len=0 TSval=3258521001 TSecr=3258521001"
"341","71.555669566","127.0.0.1","127.0.0.1","TCP","74","33742  >  8080 [PSH, ACK] Seq=20 Ack=43 Win=65536 Len=8 TSval=3258521001 TSecr=3258521001 [TCP segment of a reassembled PDU]"
"342","71.555689741","127.0.0.1","127.0.0.1","TCP","66","8080  >  33742 [ACK] Seq=43 Ack=28 Win=65536 Len=0 TSval=3258521001 TSecr=3258521001"
"343","71.555733229","127.0.0.1","127.0.0.1","TCP","86","8080  >  33742 [PSH, ACK] Seq=43 Ack=28 Win=65536 Len=20 TSval=3258521001 TSecr=3258521001 [TCP segment of a reassembled PDU]"
"344","71.555735942","127.0.0.1","127.0.0.1","TCP","66","33742  >  8080 [ACK] Seq=28 Ack=63 Win=65536 Len=0 TSval=3258521001 TSecr=3258521001"
"345","71.555753080","127.0.0.1","127.0.0.1","TCP","74","33742  >  8080 [PSH, ACK] Seq=28 Ack=63 Win=65536 Len=8 TSval=3258521001 TSecr=3258521001 [TCP segment of a reassembled PDU]"
"346","71.556465023","127.0.0.1","127.0.0.1","TCP","66","8080  >  33742 [ACK] Seq=63 Ack=36 Win=65536 Len=0 TSval=3258521002 TSecr=3258521001"
"347","71.560404671","127.0.0.1","127.0.0.1","TCP","126","33742  >  8080 [PSH, ACK] Seq=36 Ack=63 Win=65536 Len=60 TSval=3258521006 TSecr=3258521002"
"348","71.560412747","127.0.0.1","127.0.0.1","TCP","66","8080  >  33742 [ACK] Seq=63 Ack=96 Win=65536 Len=0 TSval=3258521006 TSecr=3258521006"
"353","77.230151222","127.0.0.1","127.0.0.1","TCP","67","33740  >  8080 [PSH, ACK] Seq=19 Ack=20 Win=65536 Len=1 TSval=3258526675 TSecr=3258516997 [TCP segment of a reassembled PDU]"
"354","77.230194552","127.0.0.1","127.0.0.1","TCP","66","8080  >  33740 [ACK] Seq=20 Ack=20 Win=65536 Len=0 TSval=3258526675 TSecr=3258526675"
"355","77.235066608","127.0.0.1","127.0.0.1","TCP","82","8080  >  33740 [PSH, ACK] Seq=20 Ack=20 Win=65536 Len=16 TSval=3258526680 TSecr=3258526675 [TCP segment of a reassembled PDU]"
"356","77.235074446","127.0.0.1","127.0.0.1","TCP","66","33740  >  8080 [ACK] Seq=20 Ack=36 Win=65536 Len=0 TSval=3258526680 TSecr=3258526680"
"357","77.235114934","127.0.0.1","127.0.0.1","TCP","74","33740  >  8080 [PSH, ACK] Seq=20 Ack=36 Win=65536 Len=8 TSval=3258526680 TSecr=3258526680 [TCP segment of a reassembled PDU]"
"358","77.235125268","127.0.0.1","127.0.0.1","TCP","66","8080  >  33740 [ACK] Seq=36 Ack=28 Win=65536 Len=0 TSval=3258526680 TSecr=3258526680"
"359","77.235137134","127.0.0.1","127.0.0.1","TCP","89","8080  >  33740 [PSH, ACK] Seq=36 Ack=28 Win=65536 Len=23 TSval=3258526680 TSecr=3258526680 [TCP segment of a reassembled PDU]"
"360","77.235139092","127.0.0.1","127.0.0.1","TCP","66","33740  >  8080 [ACK] Seq=28 Ack=59 Win=65536 Len=0 TSval=3258526680 TSecr=3258526680"
"361","77.235151044","127.0.0.1","127.0.0.1","TCP","74","33740  >  8080 [PSH, ACK] Seq=28 Ack=59 Win=65536 Len=8 TSval=3258526680 TSecr=3258526680 [TCP segment of a reassembled PDU]"
"362","77.235156521","127.0.0.1","127.0.0.1","TCP","66","8080  >  33740 [ACK] Seq=59 Ack=36 Win=65536 Len=0 TSval=3258526680 TSecr=3258526680"
"363","77.235196003","127.0.0.1","127.0.0.1","TCP","86","8080  >  33740 [PSH, ACK] Seq=59 Ack=36 Win=65536 Len=20 TSval=3258526680 TSecr=3258526680 [TCP segment of a reassembled PDU]"
"364","77.235198502","127.0.0.1","127.0.0.1","TCP","66","33740  >  8080 [ACK] Seq=36 Ack=79 Win=65536 Len=0 TSval=3258526680 TSecr=3258526680"
"365","77.235218912","127.0.0.1","127.0.0.1","TCP","74","33740  >  8080 [PSH, ACK] Seq=36 Ack=79 Win=65536 Len=8 TSval=3258526680 TSecr=3258526680 [TCP segment of a reassembled PDU]"
"366","77.235225859","127.0.0.1","127.0.0.1","TCP","66","8080  >  33740 [ACK] Seq=79 Ack=44 Win=65536 Len=0 TSval=3258526680 TSecr=3258526680"
"367","77.235247095","127.0.0.1","127.0.0.1","TCP","80","8080  >  33740 [PSH, ACK] Seq=79 Ack=44 Win=65536 Len=14 TSval=3258526680 TSecr=3258526680 [TCP segment of a reassembled PDU]"
"368","77.235248997","127.0.0.1","127.0.0.1","TCP","66","33740  >  8080 [ACK] Seq=44 Ack=93 Win=65536 Len=0 TSval=3258526681 TSecr=3258526680"
"369","77.235298560","127.0.0.1","127.0.0.1","TCP","74","33740  >  8080 [PSH, ACK] Seq=44 Ack=93 Win=65536 Len=8 TSval=3258526681 TSecr=3258526680 [TCP segment of a reassembled PDU]"
"370","77.235303430","127.0.0.1","127.0.0.1","TCP","66","8080  >  33740 [ACK] Seq=93 Ack=52 Win=65536 Len=0 TSval=3258526681 TSecr=3258526681"
"371","77.240251373","127.0.0.1","127.0.0.1","TCP","126","33740  >  8080 [PSH, ACK] Seq=52 Ack=93 Win=65536 Len=60 TSval=3258526685 TSecr=3258526681"
"372","77.240258436","127.0.0.1","127.0.0.1","TCP","66","8080  >  33740 [ACK] Seq=93 Ack=112 Win=65536 Len=0 TSval=3258526686 TSecr=3258526685"
"404","78.225678310","127.0.0.1","127.0.0.1","TCP","74","59304  >  443 [SYN] Seq=0 Win=65495 Len=0 MSS=65495 SACK_PERM=1 TSval=3258527671 TSecr=0 WS=128"
"405","78.225684218","127.0.0.1","127.0.0.1","TCP","54","443  >  59304 [RST, ACK] Seq=1 Ack=1 Win=0 Len=0"
"463","85.384573849","127.0.0.1","127.0.0.1","TCP","89","8080  >  33738 [PSH, ACK] Seq=79 Ack=104 Win=65536 Len=23 TSval=3258534830 TSecr=3258514829 [TCP segment of a reassembled PDU]"
"464","85.384639685","127.0.0.1","127.0.0.1","TCP","66","33738  >  8080 [ACK] Seq=104 Ack=102 Win=65536 Len=0 TSval=3258534830 TSecr=3258534830"
"465","85.385260214","127.0.0.1","127.0.0.1","TCP","66","33738  >  8080 [FIN, ACK] Seq=104 Ack=102 Win=65536 Len=0 TSval=3258534831 TSecr=3258534830"
"466","85.426854412","127.0.0.1","127.0.0.1","TCP","66","8080  >  33738 [ACK] Seq=102 Ack=105 Win=65536 Len=0 TSval=3258534872 TSecr=3258534831"
"467","88.063025816","127.0.0.1","127.0.0.1","TCP","74","33770  >  8080 [SYN] Seq=0 Win=65495 Len=0 MSS=65495 SACK_PERM=1 TSval=3258537508 TSecr=0 WS=128"
"468","88.063036586","127.0.0.1","127.0.0.1","TCP","74","8080  >  33770 [SYN, ACK] Seq=0 Ack=1 Win=65483 Len=0 MSS=65495 SACK_PERM=1 TSval=3258537508 TSecr=3258537508 WS=128"
"469","88.063045882","127.0.0.1","127.0.0.1","TCP","66","33770  >  8080 [ACK] Seq=1 Ack=1 Win=65536 Len=0 TSval=3258537508 TSecr=3258537508"
"470","88.063123189","127.0.0.1","127.0.0.1","TCP","85","8080  >  33770 [PSH, ACK] Seq=1 Ack=1 Win=65536 Len=19 TSval=3258537508 TSecr=3258537508 [TCP segment of a reassembled PDU]"
"471","88.063149957","127.0.0.1","127.0.0.1","TCP","66","33770  >  8080 [ACK] Seq=1 Ack=20 Win=65536 Len=0 TSval=3258537508 TSecr=3258537508"
"472","88.063305104","127.0.0.1","127.0.0.1","TCP","84","33770  >  8080 [PSH, ACK] Seq=1 Ack=20 Win=65536 Len=18 TSval=3258537509 TSecr=3258537508 [TCP segment of a reassembled PDU]"
"473","88.063309939","127.0.0.1","127.0.0.1","TCP","66","8080  >  33770 [ACK] Seq=20 Ack=19 Win=65536 Len=0 TSval=3258537509 TSecr=3258537509"
"474","89.902076116","127.0.0.1","127.0.0.1","TCP","67","33770  >  8080 [PSH, ACK] Seq=19 Ack=20 Win=65536 Len=1 TSval=3258539347 TSecr=3258537509 [TCP segment of a reassembled PDU]"
"475","89.902106223","127.0.0.1","127.0.0.1","TCP","66","8080  >  33770 [ACK] Seq=20 Ack=20 Win=65536 Len=0 TSval=3258539347 TSecr=3258539347"
"476","89.906914755","127.0.0.1","127.0.0.1","TCP","89","8080  >  33770 [PSH, ACK] Seq=20 Ack=20 Win=65536 Len=23 TSval=3258539352 TSecr=3258539347 [TCP segment of a reassembled PDU]"
"477","89.906922470","127.0.0.1","127.0.0.1","TCP","66","33770  >  8080 [ACK] Seq=20 Ack=43 Win=65536 Len=0 TSval=3258539352 TSecr=3258539352"
"478","89.907010977","127.0.0.1","127.0.0.1","TCP","74","33770  >  8080 [PSH, ACK] Seq=20 Ack=43 Win=65536 Len=8 TSval=3258539352 TSecr=3258539352 [TCP segment of a reassembled PDU]"
"479","89.907015712","127.0.0.1","127.0.0.1","TCP","66","8080  >  33770 [ACK] Seq=43 Ack=28 Win=65536 Len=0 TSval=3258539352 TSecr=3258539352"
"480","89.907066767","127.0.0.1","127.0.0.1","TCP","86","8080  >  33770 [PSH, ACK] Seq=43 Ack=28 Win=65536 Len=20 TSval=3258539352 TSecr=3258539352 [TCP segment of a reassembled PDU]"
"481","89.907069387","127.0.0.1","127.0.0.1","TCP","66","33770  >  8080 [ACK] Seq=28 Ack=63 Win=65536 Len=0 TSval=3258539352 TSecr=3258539352"
"482","89.907152876","127.0.0.1","127.0.0.1","TCP","74","33770  >  8080 [PSH, ACK] Seq=28 Ack=63 Win=65536 Len=8 TSval=3258539352 TSecr=3258539352 [TCP segment of a reassembled PDU]"
"483","89.907157782","127.0.0.1","127.0.0.1","TCP","66","8080  >  33770 [ACK] Seq=63 Ack=36 Win=65536 Len=0 TSval=3258539352 TSecr=3258539352"
"484","89.911615484","127.0.0.1","127.0.0.1","TCP","126","33770  >  8080 [PSH, ACK] Seq=36 Ack=63 Win=65536 Len=60 TSval=3258539357 TSecr=3258539352"
"485","89.911622668","127.0.0.1","127.0.0.1","TCP","66","8080  >  33770 [ACK] Seq=63 Ack=96 Win=65536 Len=0 TSval=3258539357 TSecr=3258539357"
"486","91.561245689","127.0.0.1","127.0.0.1","TCP","89","8080  >  33742 [PSH, ACK] Seq=63 Ack=96 Win=65536 Len=23 TSval=3258541006 TSecr=3258521006 [TCP segment of a reassembled PDU]"
"487","91.561277357","127.0.0.1","127.0.0.1","TCP","66","33742  >  8080 [ACK] Seq=96 Ack=86 Win=65536 Len=0 TSval=3258541007 TSecr=3258541006"
"488","91.561486941","127.0.0.1","127.0.0.1","TCP","66","33742  >  8080 [FIN, ACK] Seq=96 Ack=86 Win=65536 Len=0 TSval=3258541007 TSecr=3258541006"
"489","91.606874149","127.0.0.1","127.0.0.1","TCP","66","8080  >  33742 [ACK] Seq=86 Ack=97 Win=65536 Len=0 TSval=3258541052 TSecr=3258541007"
"490","93.191151830","127.0.0.1","127.0.0.1","TCP","74","33772  >  8080 [SYN] Seq=0 Win=65495 Len=0 MSS=65495 SACK_PERM=1 TSval=3258542636 TSecr=0 WS=128"
"491","93.191163919","127.0.0.1","127.0.0.1","TCP","74","8080  >  33772 [SYN, ACK] Seq=0 Ack=1 Win=65483 Len=0 MSS=65495 SACK_PERM=1 TSval=3258542636 TSecr=3258542636 WS=128"
"492","93.191173105","127.0.0.1","127.0.0.1","TCP","66","33772  >  8080 [ACK] Seq=1 Ack=1 Win=65536 Len=0 TSval=3258542636 TSecr=3258542636"
"493","93.191275615","127.0.0.1","127.0.0.1","TCP","85","8080  >  33772 [PSH, ACK] Seq=1 Ack=1 Win=65536 Len=19 TSval=3258542637 TSecr=3258542636 [TCP segment of a reassembled PDU]"
"494","93.191303217","127.0.0.1","127.0.0.1","TCP","66","33772  >  8080 [ACK] Seq=1 Ack=20 Win=65536 Len=0 TSval=3258542637 TSecr=3258542637"
"495","93.191455997","127.0.0.1","127.0.0.1","TCP","84","33772  >  8080 [PSH, ACK] Seq=1 Ack=20 Win=65536 Len=18 TSval=3258542637 TSecr=3258542637 [TCP segment of a reassembled PDU]"
"496","93.191460874","127.0.0.1","127.0.0.1","TCP","66","8080  >  33772 [ACK] Seq=20 Ack=19 Win=65536 Len=0 TSval=3258542637 TSecr=3258542637"
"497","94.933967360","127.0.0.1","127.0.0.1","TCP","67","33772  >  8080 [PSH, ACK] Seq=19 Ack=20 Win=65536 Len=1 TSval=3258544379 TSecr=3258542637 [TCP segment of a reassembled PDU]"
"498","94.933998560","127.0.0.1","127.0.0.1","TCP","66","8080  >  33772 [ACK] Seq=20 Ack=20 Win=65536 Len=0 TSval=3258544379 TSecr=3258544379"
"499","94.938919424","127.0.0.1","127.0.0.1","TCP","82","8080  >  33772 [PSH, ACK] Seq=20 Ack=20 Win=65536 Len=16 TSval=3258544384 TSecr=3258544379 [TCP segment of a reassembled PDU]"
"500","94.938927095","127.0.0.1","127.0.0.1","TCP","66","33772  >  8080 [ACK] Seq=20 Ack=36 Win=65536 Len=0 TSval=3258544384 TSecr=3258544384"
"501","94.939035949","127.0.0.1","127.0.0.1","TCP","74","33772  >  8080 [PSH, ACK] Seq=20 Ack=36 Win=65536 Len=8 TSval=3258544384 TSecr=3258544384 [TCP segment of a reassembled PDU]"
"502","94.939040799","127.0.0.1","127.0.0.1","TCP","66","8080  >  33772 [ACK] Seq=36 Ack=28 Win=65536 Len=0 TSval=3258544384 TSecr=3258544384"
"503","94.939090038","127.0.0.1","127.0.0.1","TCP","89","8080  >  33772 [PSH, ACK] Seq=36 Ack=28 Win=65536 Len=23 TSval=3258544384 TSecr=3258544384 [TCP segment of a reassembled PDU]"
"504","94.939092861","127.0.0.1","127.0.0.1","TCP","66","33772  >  8080 [ACK] Seq=28 Ack=59 Win=65536 Len=0 TSval=3258544384 TSecr=3258544384"
"505","94.939131856","127.0.0.1","127.0.0.1","TCP","74","33772  >  8080 [PSH, ACK] Seq=28 Ack=59 Win=65536 Len=8 TSval=3258544384 TSecr=3258544384 [TCP segment of a reassembled PDU]"
"506","94.939134288","127.0.0.1","127.0.0.1","TCP","66","8080  >  33772 [ACK] Seq=59 Ack=36 Win=65536 Len=0 TSval=3258544384 TSecr=3258544384"
"507","94.939158329","127.0.0.1","127.0.0.1","TCP","86","8080  >  33772 [PSH, ACK] Seq=59 Ack=36 Win=65536 Len=20 TSval=3258544384 TSecr=3258544384 [TCP segment of a reassembled PDU]"
"508","94.939160732","127.0.0.1","127.0.0.1","TCP","66","33772  >  8080 [ACK] Seq=36 Ack=79 Win=65536 Len=0 TSval=3258544384 TSecr=3258544384"
"509","94.939178089","127.0.0.1","127.0.0.1","TCP","74","33772  >  8080 [PSH, ACK] Seq=36 Ack=79 Win=65536 Len=8 TSval=3258544384 TSecr=3258544384 [TCP segment of a reassembled PDU]"
"510","94.939180038","127.0.0.1","127.0.0.1","TCP","66","8080  >  33772 [ACK] Seq=79 Ack=44 Win=65536 Len=0 TSval=3258544384 TSecr=3258544384"
"511","94.943617331","127.0.0.1","127.0.0.1","TCP","126","33772  >  8080 [PSH, ACK] Seq=44 Ack=79 Win=65536 Len=60 TSval=3258544389 TSecr=3258544384"
"512","94.943623456","127.0.0.1","127.0.0.1","TCP","66","8080  >  33772 [ACK] Seq=79 Ack=104 Win=65536 Len=0 TSval=3258544389 TSecr=3258544389"
"513","97.240697344","127.0.0.1","127.0.0.1","TCP","89","8080  >  33740 [PSH, ACK] Seq=93 Ack=112 Win=65536 Len=23 TSval=3258546686 TSecr=3258526685 [TCP segment of a reassembled PDU]"
"514","97.240755427","127.0.0.1","127.0.0.1","TCP","66","33740  >  8080 [ACK] Seq=112 Ack=116 Win=65536 Len=0 TSval=3258546686 TSecr=3258546686"
"515","97.241151961","127.0.0.1","127.0.0.1","TCP","66","33740  >  8080 [FIN, ACK] Seq=112 Ack=116 Win=65536 Len=0 TSval=3258546686 TSecr=3258546686"
"516","97.282643787","127.0.0.1","127.0.0.1","TCP","66","8080  >  33740 [ACK] Seq=116 Ack=113 Win=65536 Len=0 TSval=3258546728 TSecr=3258546686"
"517","98.815173186","127.0.0.1","127.0.0.1","TCP","74","33774  >  8080 [SYN] Seq=0 Win=65495 Len=0 MSS=65495 SACK_PERM=1 TSval=3258548260 TSecr=0 WS=128"
"518","98.815189543","127.0.0.1","127.0.0.1","TCP","74","8080  >  33774 [SYN, ACK] Seq=0 Ack=1 Win=65483 Len=0 MSS=65495 SACK_PERM=1 TSval=3258548260 TSecr=3258548260 WS=128"
"519","98.815199291","127.0.0.1","127.0.0.1","TCP","66","33774  >  8080 [ACK] Seq=1 Ack=1 Win=65536 Len=0 TSval=3258548260 TSecr=3258548260"
"520","98.815238067","127.0.0.1","127.0.0.1","TCP","85","8080  >  33774 [PSH, ACK] Seq=1 Ack=1 Win=65536 Len=19 TSval=3258548260 TSecr=3258548260 [TCP segment of a reassembled PDU]"
"521","98.815244270","127.0.0.1","127.0.0.1","TCP","66","33774  >  8080 [ACK] Seq=1 Ack=20 Win=65536 Len=0 TSval=3258548260 TSecr=3258548260"
"522","98.815346160","127.0.0.1","127.0.0.1","TCP","84","33774  >  8080 [PSH, ACK] Seq=1 Ack=20 Win=65536 Len=18 TSval=3258548261 TSecr=3258548260 [TCP segment of a reassembled PDU]"
"523","98.815349233","127.0.0.1","127.0.0.1","TCP","66","8080  >  33774 [ACK] Seq=20 Ack=19 Win=65536 Len=0 TSval=3258548261 TSecr=3258548261"
"524","101.086024325","127.0.0.1","127.0.0.1","TCP","67","33774  >  8080 [PSH, ACK] Seq=19 Ack=20 Win=65536 Len=1 TSval=3258550531 TSecr=3258548261 [TCP segment of a reassembled PDU]"
"525","101.086060931","127.0.0.1","127.0.0.1","TCP","66","8080  >  33774 [ACK] Seq=20 Ack=20 Win=65536 Len=0 TSval=3258550531 TSecr=3258550531"
"526","101.091168126","127.0.0.1","127.0.0.1","TCP","82","8080  >  33774 [PSH, ACK] Seq=20 Ack=20 Win=65536 Len=16 TSval=3258550536 TSecr=3258550531 [TCP segment of a reassembled PDU]"
"527","101.091176475","127.0.0.1","127.0.0.1","TCP","66","33774  >  8080 [ACK] Seq=20 Ack=36 Win=65536 Len=0 TSval=3258550536 TSecr=3258550536"
"528","101.091288143","127.0.0.1","127.0.0.1","TCP","74","33774  >  8080 [PSH, ACK] Seq=20 Ack=36 Win=65536 Len=8 TSval=3258550537 TSecr=3258550536 [TCP segment of a reassembled PDU]"
"529","101.091292953","127.0.0.1","127.0.0.1","TCP","66","8080  >  33774 [ACK] Seq=36 Ack=28 Win=65536 Len=0 TSval=3258550537 TSecr=3258550537"
"530","101.091342920","127.0.0.1","127.0.0.1","TCP","89","8080  >  33774 [PSH, ACK] Seq=36 Ack=28 Win=65536 Len=23 TSval=3258550537 TSecr=3258550537 [TCP segment of a reassembled PDU]"
"531","101.091345806","127.0.0.1","127.0.0.1","TCP","66","33774  >  8080 [ACK] Seq=28 Ack=59 Win=65536 Len=0 TSval=3258550537 TSecr=3258550537"
"532","101.091369755","127.0.0.1","127.0.0.1","TCP","74","33774  >  8080 [PSH, ACK] Seq=28 Ack=59 Win=65536 Len=8 TSval=3258550537 TSecr=3258550537 [TCP segment of a reassembled PDU]"
"533","101.091372163","127.0.0.1","127.0.0.1","TCP","66","8080  >  33774 [ACK] Seq=59 Ack=36 Win=65536 Len=0 TSval=3258550537 TSecr=3258550537"
"534","101.091390972","127.0.0.1","127.0.0.1","TCP","88","8080  >  33774 [PSH, ACK] Seq=59 Ack=36 Win=65536 Len=22 TSval=3258550537 TSecr=3258550537 [TCP segment of a reassembled PDU]"
"535","101.091393120","127.0.0.1","127.0.0.1","TCP","66","33774  >  8080 [ACK] Seq=36 Ack=81 Win=65536 Len=0 TSval=3258550537 TSecr=3258550537"
"536","101.091410683","127.0.0.1","127.0.0.1","TCP","74","33774  >  8080 [PSH, ACK] Seq=36 Ack=81 Win=65536 Len=8 TSval=3258550537 TSecr=3258550537 [TCP segment of a reassembled PDU]"
"537","101.091412704","127.0.0.1","127.0.0.1","TCP","66","8080  >  33774 [ACK] Seq=81 Ack=44 Win=65536 Len=0 TSval=3258550537 TSecr=3258550537"
"538","101.091485872","127.0.0.1","127.0.0.1","TCP","86","8080  >  33774 [PSH, ACK] Seq=81 Ack=44 Win=65536 Len=20 TSval=3258550537 TSecr=3258550537 [TCP segment of a reassembled PDU]"
"539","101.091490837","127.0.0.1","127.0.0.1","TCP","66","33774  >  8080 [ACK] Seq=44 Ack=101 Win=65536 Len=0 TSval=3258550537 TSecr=3258550537"
"540","101.091612582","127.0.0.1","127.0.0.1","TCP","74","33774  >  8080 [PSH, ACK] Seq=44 Ack=101 Win=65536 Len=8 TSval=3258550537 TSecr=3258550537 [TCP segment of a reassembled PDU]"
"541","101.091617148","127.0.0.1","127.0.0.1","TCP","66","8080  >  33774 [ACK] Seq=101 Ack=52 Win=65536 Len=0 TSval=3258550537 TSecr=3258550537"
"542","101.091710921","127.0.0.1","127.0.0.1","TCP","80","8080  >  33774 [PSH, ACK] Seq=101 Ack=52 Win=65536 Len=14 TSval=3258550537 TSecr=3258550537 [TCP segment of a reassembled PDU]"
"543","101.091715497","127.0.0.1","127.0.0.1","TCP","66","33774  >  8080 [ACK] Seq=52 Ack=115 Win=65536 Len=0 TSval=3258550537 TSecr=3258550537"
"544","101.091742495","127.0.0.1","127.0.0.1","TCP","74","33774  >  8080 [PSH, ACK] Seq=52 Ack=115 Win=65536 Len=8 TSval=3258550537 TSecr=3258550537 [TCP segment of a reassembled PDU]"
"545","101.091744947","127.0.0.1","127.0.0.1","TCP","66","8080  >  33774 [ACK] Seq=115 Ack=60 Win=65536 Len=0 TSval=3258550537 TSecr=3258550537"
"546","101.096874842","127.0.0.1","127.0.0.1","TCP","126","33774  >  8080 [PSH, ACK] Seq=60 Ack=115 Win=65536 Len=60 TSval=3258550542 TSecr=3258550537"
"547","101.096882923","127.0.0.1","127.0.0.1","TCP","66","8080  >  33774 [ACK] Seq=115 Ack=120 Win=65536 Len=0 TSval=3258550542 TSecr=3258550542"
"552","109.912592949","127.0.0.1","127.0.0.1","TCP","89","8080  >  33770 [PSH, ACK] Seq=63 Ack=96 Win=65536 Len=23 TSval=3258559358 TSecr=3258539357 [TCP segment of a reassembled PDU]"
"553","109.912651667","127.0.0.1","127.0.0.1","TCP","66","33770  >  8080 [ACK] Seq=96 Ack=86 Win=65536 Len=0 TSval=3258559358 TSecr=3258559358"
"554","109.913004384","127.0.0.1","127.0.0.1","TCP","66","33770  >  8080 [FIN, ACK] Seq=96 Ack=86 Win=65536 Len=0 TSval=3258559358 TSecr=3258559358"
"555","109.954392918","127.0.0.1","127.0.0.1","TCP","66","8080  >  33770 [ACK] Seq=86 Ack=97 Win=65536 Len=0 TSval=3258559400 TSecr=3258559358"
"635","112.738753639","127.0.0.1","127.0.0.1","TCP","74","59344  >  443 [SYN] Seq=0 Win=65495 Len=0 MSS=65495 SACK_PERM=1 TSval=3258562184 TSecr=0 WS=128"
"636","112.738760768","127.0.0.1","127.0.0.1","TCP","54","443  >  59344 [RST, ACK] Seq=1 Ack=1 Win=0 Len=0"
"654","114.702921588","127.0.0.1","127.0.0.1","TCP","74","33800  >  8080 [SYN] Seq=0 Win=65495 Len=0 MSS=65495 SACK_PERM=1 TSval=3258564148 TSecr=0 WS=128"
"655","114.702933050","127.0.0.1","127.0.0.1","TCP","74","8080  >  33800 [SYN, ACK] Seq=0 Ack=1 Win=65483 Len=0 MSS=65495 SACK_PERM=1 TSval=3258564148 TSecr=3258564148 WS=128"
"656","114.702942354","127.0.0.1","127.0.0.1","TCP","66","33800  >  8080 [ACK] Seq=1 Ack=1 Win=65536 Len=0 TSval=3258564148 TSecr=3258564148"
"657","114.702977820","127.0.0.1","127.0.0.1","TCP","85","8080  >  33800 [PSH, ACK] Seq=1 Ack=1 Win=65536 Len=19 TSval=3258564148 TSecr=3258564148 [TCP segment of a reassembled PDU]"
"658","114.702984328","127.0.0.1","127.0.0.1","TCP","66","33800  >  8080 [ACK] Seq=1 Ack=20 Win=65536 Len=0 TSval=3258564148 TSecr=3258564148"
"659","114.703105530","127.0.0.1","127.0.0.1","TCP","84","33800  >  8080 [PSH, ACK] Seq=1 Ack=20 Win=65536 Len=18 TSval=3258564148 TSecr=3258564148 [TCP segment of a reassembled PDU]"
"660","114.703109200","127.0.0.1","127.0.0.1","TCP","66","8080  >  33800 [ACK] Seq=20 Ack=19 Win=65536 Len=0 TSval=3258564148 TSecr=3258564148"
"661","114.943909764","127.0.0.1","127.0.0.1","TCP","89","8080  >  33772 [PSH, ACK] Seq=79 Ack=104 Win=65536 Len=23 TSval=3258564389 TSecr=3258544389 [TCP segment of a reassembled PDU]"
"662","114.943974542","127.0.0.1","127.0.0.1","TCP","66","33772  >  8080 [ACK] Seq=104 Ack=102 Win=65536 Len=0 TSval=3258564389 TSecr=3258564389"
"663","114.944355998","127.0.0.1","127.0.0.1","TCP","66","33772  >  8080 [FIN, ACK] Seq=104 Ack=102 Win=65536 Len=0 TSval=3258564390 TSecr=3258564389"
"664","114.986603747","127.0.0.1","127.0.0.1","TCP","66","8080  >  33772 [ACK] Seq=102 Ack=105 Win=65536 Len=0 TSval=3258564432 TSecr=3258564390"
"665","116.566088038","127.0.0.1","127.0.0.1","TCP","67","33800  >  8080 [PSH, ACK] Seq=19 Ack=20 Win=65536 Len=1 TSval=3258566011 TSecr=3258564148 [TCP segment of a reassembled PDU]"
"666","116.566120238","127.0.0.1","127.0.0.1","TCP","66","8080  >  33800 [ACK] Seq=20 Ack=20 Win=65536 Len=0 TSval=3258566011 TSecr=3258566011"
"667","116.571077297","127.0.0.1","127.0.0.1","TCP","86","8080  >  33800 [PSH, ACK] Seq=20 Ack=20 Win=65536 Len=20 TSval=3258566016 TSecr=3258566011 [TCP segment of a reassembled PDU]"
"668","116.571086886","127.0.0.1","127.0.0.1","TCP","66","33800  >  8080 [ACK] Seq=20 Ack=40 Win=65536 Len=0 TSval=3258566016 TSecr=3258566016"
"669","116.571150559","127.0.0.1","127.0.0.1","TCP","74","33800  >  8080 [PSH, ACK] Seq=20 Ack=40 Win=65536 Len=8 TSval=3258566016 TSecr=3258566016 [TCP segment of a reassembled PDU]"
"670","116.571632028","127.0.0.1","127.0.0.1","TCP","66","8080  >  33800 [ACK] Seq=40 Ack=28 Win=65536 Len=0 TSval=3258566017 TSecr=3258566016"
"671","116.576092581","127.0.0.1","127.0.0.1","TCP","126","33800  >  8080 [PSH, ACK] Seq=28 Ack=40 Win=65536 Len=60 TSval=3258566021 TSecr=3258566017"
"672","116.576100672","127.0.0.1","127.0.0.1","TCP","66","8080  >  33800 [ACK] Seq=40 Ack=88 Win=65536 Len=0 TSval=3258566021 TSecr=3258566021"
"673","121.097918185","127.0.0.1","127.0.0.1","TCP","89","8080  >  33774 [PSH, ACK] Seq=115 Ack=120 Win=65536 Len=23 TSval=3258570543 TSecr=3258550542 [TCP segment of a reassembled PDU]"
"674","121.097985785","127.0.0.1","127.0.0.1","TCP","66","33774  >  8080 [ACK] Seq=120 Ack=138 Win=65536 Len=0 TSval=3258570543 TSecr=3258570543"
"675","121.098548239","127.0.0.1","127.0.0.1","TCP","66","33774  >  8080 [FIN, ACK] Seq=120 Ack=138 Win=65536 Len=0 TSval=3258570544 TSecr=3258570543"
"676","121.142326159","127.0.0.1","127.0.0.1","TCP","66","8080  >  33774 [ACK] Seq=138 Ack=121 Win=65536 Len=0 TSval=3258570588 TSecr=3258570544"
"681","136.576396092","127.0.0.1","127.0.0.1","TCP","89","8080  >  33800 [PSH, ACK] Seq=40 Ack=88 Win=65536 Len=23 TSval=3258586022 TSecr=3258566021 [TCP segment of a reassembled PDU]"
"682","136.576458082","127.0.0.1","127.0.0.1","TCP","66","33800  >  8080 [ACK] Seq=88 Ack=63 Win=65536 Len=0 TSval=3258586022 TSecr=3258586022"
"683","136.576911232","127.0.0.1","127.0.0.1","TCP","66","33800  >  8080 [FIN, ACK] Seq=88 Ack=63 Win=65536 Len=0 TSval=3258586022 TSecr=3258586022"
"684","136.619036593","127.0.0.1","127.0.0.1","TCP","66","8080  >  33800 [ACK] Seq=63 Ack=89 Win=65536 Len=0 TSval=3258586064 TSecr=3258586022"
"685","138.769381936","127.0.0.1","127.0.0.1","TCP","66","8080  >  33800 [FIN, ACK] Seq=63 Ack=89 Win=65536 Len=0 TSval=3258588215 TSecr=3258586022"
"686","138.769403436","127.0.0.1","127.0.0.1","TCP","66","33800  >  8080 [ACK] Seq=89 Ack=64 Win=65536 Len=0 TSval=3258588215 TSecr=3258588215"
"687","138.769437025","127.0.0.1","127.0.0.1","TCP","66","8080  >  33774 [FIN, ACK] Seq=138 Ack=121 Win=65536 Len=0 TSval=3258588215 TSecr=3258570544"
"688","138.769442156","127.0.0.1","127.0.0.1","TCP","66","33774  >  8080 [ACK] Seq=121 Ack=139 Win=65536 Len=0 TSval=3258588215 TSecr=3258588215"
"689","138.769456843","127.0.0.1","127.0.0.1","TCP","66","8080  >  33772 [FIN, ACK] Seq=102 Ack=105 Win=65536 Len=0 TSval=3258588215 TSecr=3258564390"
"690","138.769461323","127.0.0.1","127.0.0.1","TCP","66","33772  >  8080 [ACK] Seq=105 Ack=103 Win=65536 Len=0 TSval=3258588215 TSecr=3258588215"
"691","138.769473311","127.0.0.1","127.0.0.1","TCP","66","8080  >  33770 [FIN, ACK] Seq=86 Ack=97 Win=65536 Len=0 TSval=3258588215 TSecr=3258559358"
"692","138.769477272","127.0.0.1","127.0.0.1","TCP","66","33770  >  8080 [ACK] Seq=97 Ack=87 Win=65536 Len=0 TSval=3258588215 TSecr=3258588215"
"693","138.769489090","127.0.0.1","127.0.0.1","TCP","66","8080  >  33742 [FIN, ACK] Seq=86 Ack=97 Win=65536 Len=0 TSval=3258588215 TSecr=3258541007"
"694","138.769493143","127.0.0.1","127.0.0.1","TCP","66","33742  >  8080 [ACK] Seq=97 Ack=87 Win=65536 Len=0 TSval=3258588215 TSecr=3258588215"
"695","138.769504269","127.0.0.1","127.0.0.1","TCP","66","8080  >  33740 [FIN, ACK] Seq=116 Ack=113 Win=65536 Len=0 TSval=3258588215 TSecr=3258546686"
"696","138.769508493","127.0.0.1","127.0.0.1","TCP","66","33740  >  8080 [ACK] Seq=113 Ack=117 Win=65536 Len=0 TSval=3258588215 TSecr=3258588215"
"697","138.769518897","127.0.0.1","127.0.0.1","TCP","66","8080  >  33738 [FIN, ACK] Seq=102 Ack=105 Win=65536 Len=0 TSval=3258588215 TSecr=3258534831"
"698","138.769523042","127.0.0.1","127.0.0.1","TCP","66","33738  >  8080 [ACK] Seq=105 Ack=103 Win=65536 Len=0 TSval=3258588215 TSecr=3258588215"
"699","138.769533217","127.0.0.1","127.0.0.1","TCP","66","8080  >  33708 [FIN, ACK] Seq=152 Ack=129 Win=65536 Len=0 TSval=3258588215 TSecr=3258503615"
"700","138.769537792","127.0.0.1","127.0.0.1","TCP","54","33708  >  8080 [RST] Seq=129 Win=0 Len=0"
"701","138.769547785","127.0.0.1","127.0.0.1","TCP","66","8080  >  33706 [FIN, ACK] Seq=86 Ack=97 Win=65536 Len=0 TSval=3258588215 TSecr=3258498271"
"702","138.769551323","127.0.0.1","127.0.0.1","TCP","54","33706  >  8080 [RST] Seq=97 Win=0 Len=0"
"703","138.769560996","127.0.0.1","127.0.0.1","TCP","66","8080  >  33704 [FIN, ACK] Seq=116 Ack=113 Win=65536 Len=0 TSval=3258588215 TSecr=3258494303"
"704","138.769564403","127.0.0.1","127.0.0.1","TCP","54","33704  >  8080 [RST] Seq=113 Win=0 Len=0"
"711","143.233790017","127.0.0.1","127.0.0.1","TCP","74","59348  >  443 [SYN] Seq=0 Win=65495 Len=0 MSS=65495 SACK_PERM=1 TSval=3258592679 TSecr=0 WS=128"
"712","143.233798844","127.0.0.1","127.0.0.1","TCP","54","443  >  59348 [RST, ACK] Seq=1 Ack=1 Win=0 Len=0"
"715","143.240249054","127.0.0.1","127.0.0.1","TCP","74","59350  >  443 [SYN] Seq=0 Win=65495 Len=0 MSS=65495 SACK_PERM=1 TSval=3258592685 TSecr=0 WS=128"
"716","143.240256319","127.0.0.1","127.0.0.1","TCP","54","443  >  59350 [RST, ACK] Seq=1 Ack=1 Win=0 Len=0"
