"No.","Time","Source","Destination","Protocol","Length","Info"
"1","0.000000000","127.0.0.1","127.0.0.1","TCP","74","35798  >  8080 [SYN] Seq=0 Win=65495 Len=0 MSS=65495 SACK_PERM=1 TSval=966866108 TSecr=0 WS=128"
"2","0.000010451","127.0.0.1","127.0.0.1","TCP","74","8080  >  35798 [SYN, ACK] Seq=0 Ack=1 Win=65483 Len=0 MSS=65495 SACK_PERM=1 TSval=966866108 TSecr=966866108 WS=128"
"3","0.000019569","127.0.0.1","127.0.0.1","TCP","66","35798  >  8080 [ACK] Seq=1 Ack=1 Win=65536 Len=0 TSval=966866108 TSecr=966866108"
"4","0.000059035","127.0.0.1","127.0.0.1","TCP","85","8080  >  35798 [PSH, ACK] Seq=1 Ack=1 Win=65536 Len=19 TSval=966866108 TSecr=966866108 [TCP segment of a reassembled PDU]"
"5","0.000084300","127.0.0.1","127.0.0.1","TCP","66","35798  >  8080 [ACK] Seq=1 Ack=20 Win=65536 Len=0 TSval=966866108 TSecr=966866108"
"6","0.000220884","127.0.0.1","127.0.0.1","TCP","84","35798  >  8080 [PSH, ACK] Seq=1 Ack=20 Win=65536 Len=18 TSval=966866108 TSecr=966866108 [TCP segment of a reassembled PDU]"
"7","0.000225867","127.0.0.1","127.0.0.1","TCP","66","8080  >  35798 [ACK] Seq=20 Ack=19 Win=65536 Len=0 TSval=966866108 TSecr=966866108"
"8","1.001006693","127.0.0.1","127.0.0.1","TCP","67","35798  >  8080 [PSH, ACK] Seq=19 Ack=20 Win=65536 Len=1 TSval=966867109 TSecr=966866108 [TCP segment of a reassembled PDU]"
"9","1.001071584","127.0.0.1","127.0.0.1","TCP","66","8080  >  35798 [ACK] Seq=20 Ack=20 Win=65536 Len=0 TSval=966867109 TSecr=966867109"
"10","1.010933156","127.0.0.1","127.0.0.1","TCP","88","8080  >  35798 [PSH, ACK] Seq=20 Ack=20 Win=65536 Len=22 TSval=966867119 TSecr=966867109 [TCP segment of a reassembled PDU]"
"11","1.010945562","127.0.0.1","127.0.0.1","TCP","66","35798  >  8080 [ACK] Seq=20 Ack=42 Win=65536 Len=0 TSval=966867119 TSecr=966867119"
"12","1.011164060","127.0.0.1","127.0.0.1","TCP","74","35798  >  8080 [PSH, ACK] Seq=20 Ack=42 Win=65536 Len=8 TSval=966867119 TSecr=966867119 [TCP segment of a reassembled PDU]"
"13","1.011174730","127.0.0.1","127.0.0.1","TCP","66","8080  >  35798 [ACK] Seq=42 Ack=28 Win=65536 Len=0 TSval=966867119 TSecr=966867119"
"14","1.011253237","127.0.0.1","127.0.0.1","TCP","88","8080  >  35798 [PSH, ACK] Seq=42 Ack=28 Win=65536 Len=22 TSval=966867119 TSecr=966867119 [TCP segment of a reassembled PDU]"
"15","1.011261043","127.0.0.1","127.0.0.1","TCP","66","35798  >  8080 [ACK] Seq=28 Ack=64 Win=65536 Len=0 TSval=966867119 TSecr=966867119"
"16","1.011373543","127.0.0.1","127.0.0.1","TCP","74","35798  >  8080 [PSH, ACK] Seq=28 Ack=64 Win=65536 Len=8 TSval=966867119 TSecr=966867119 [TCP segment of a reassembled PDU]"
"17","1.011397466","127.0.0.1","127.0.0.1","TCP","66","8080  >  35798 [ACK] Seq=64 Ack=36 Win=65536 Len=0 TSval=966867119 TSecr=966867119"
"18","1.011472702","127.0.0.1","127.0.0.1","TCP","82","8080  >  35798 [PSH, ACK] Seq=64 Ack=36 Win=65536 Len=16 TSval=966867119 TSecr=966867119 [TCP segment of a reassembled PDU]"
"19","1.011478208","127.0.0.1","127.0.0.1","TCP","66","35798  >  8080 [ACK] Seq=36 Ack=80 Win=65536 Len=0 TSval=966867119 TSecr=966867119"
"20","1.011555600","127.0.0.1","127.0.0.1","TCP","74","35798  >  8080 [PSH, ACK] Seq=36 Ack=80 Win=65536 Len=8 TSval=966867119 TSecr=966867119 [TCP segment of a reassembled PDU]"
"21","1.011576586","127.0.0.1","127.0.0.1","TCP","66","8080  >  35798 [ACK] Seq=80 Ack=44 Win=65536 Len=0 TSval=966867119 TSecr=966867119"
"22","1.011645957","127.0.0.1","127.0.0.1","TCP","89","8080  >  35798 [PSH, ACK] Seq=80 Ack=44 Win=65536 Len=23 TSval=966867119 TSecr=966867119 [TCP segment of a reassembled PDU]"
"23","1.011681938","127.0.0.1","127.0.0.1","TCP","66","35798  >  8080 [ACK] Seq=44 Ack=103 Win=65536 Len=0 TSval=966867119 TSecr=966867119"
"24","1.011724911","127.0.0.1","127.0.0.1","TCP","74","35798  >  8080 [PSH, ACK] Seq=44 Ack=103 Win=65536 Len=8 TSval=966867119 TSecr=966867119 [TCP segment of a reassembled PDU]"
"25","1.011740133","127.0.0.1","127.0.0.1","TCP","66","8080  >  35798 [ACK] Seq=103 Ack=52 Win=65536 Len=0 TSval=966867119 TSecr=966867119"
"26","1.011772986","127.0.0.1","127.0.0.1","TCP","92","8080  >  35798 [PSH, ACK] Seq=103 Ack=52 Win=65536 Len=26 TSval=966867119 TSecr=966867119 [TCP segment of a reassembled PDU]"
"27","1.011777059","127.0.0.1","127.0.0.1","TCP","66","35798  >  8080 [ACK] Seq=52 Ack=129 Win=65536 Len=0 TSval=966867119 TSecr=966867119"
"28","1.011809691","127.0.0.1","127.0.0.1","TCP","74","35798  >  8080 [PSH, ACK] Seq=52 Ack=129 Win=65536 Len=8 TSval=966867120 TSecr=966867119 [TCP segment of a reassembled PDU]"
"29","1.012452121","127.0.0.1","127.0.0.1","TCP","66","8080  >  35798 [ACK] Seq=129 Ack=60 Win=65536 Len=0 TSval=966867120 TSecr=966867120"
"30","1.022186091","127.0.0.1","127.0.0.1","TCP","129","35798  >  8080 [PSH, ACK] Seq=60 Ack=129 Win=65536 Len=63 TSval=966867130 TSecr=966867120"
"31","1.022199656","127.0.0.1","127.0.0.1","TCP","66","8080  >  35798 [ACK] Seq=129 Ack=123 Win=65536 Len=0 TSval=966867130 TSecr=966867130"
"32","1.022268271","127.0.0.1","127.0.0.1","TCP","89","8080  >  35798 [PSH, ACK] Seq=129 Ack=123 Win=65536 Len=23 TSval=966867130 TSecr=966867130 [TCP segment of a reassembled PDU]"
"33","1.022390657","127.0.0.1","127.0.0.1","TCP","66","35798  >  8080 [ACK] Seq=123 Ack=152 Win=65536 Len=0 TSval=966867130 TSecr=966867130"
"34","1.022684551","127.0.0.1","127.0.0.1","TCP","66","35798  >  8080 [FIN, ACK] Seq=123 Ack=152 Win=65536 Len=0 TSval=966867130 TSecr=966867130"
"35","1.024552557","127.0.0.1","127.0.0.1","TCP","74","35800  >  8080 [SYN] Seq=0 Win=65495 Len=0 MSS=65495 SACK_PERM=1 TSval=966867132 TSecr=0 WS=128"
"36","1.024570318","127.0.0.1","127.0.0.1","TCP","74","8080  >  35800 [SYN, ACK] Seq=0 Ack=1 Win=65483 Len=0 MSS=65495 SACK_PERM=1 TSval=966867132 TSecr=966867132 WS=128"
"37","1.024587660","127.0.0.1","127.0.0.1","TCP","66","35800  >  8080 [ACK] Seq=1 Ack=1 Win=65536 Len=0 TSval=966867132 TSecr=966867132"
"38","1.024774887","127.0.0.1","127.0.0.1","TCP","85","8080  >  35800 [PSH, ACK] Seq=1 Ack=1 Win=65536 Len=19 TSval=966867132 TSecr=966867132 [TCP segment of a reassembled PDU]"
"39","1.024840765","127.0.0.1","127.0.0.1","TCP","66","35800  >  8080 [ACK] Seq=1 Ack=20 Win=65536 Len=0 TSval=966867132 TSecr=966867132"
"40","1.025158444","127.0.0.1","127.0.0.1","TCP","84","35800  >  8080 [PSH, ACK] Seq=1 Ack=20 Win=65536 Len=18 TSval=966867133 TSecr=966867132 [TCP segment of a reassembled PDU]"
"41","1.025169663","127.0.0.1","127.0.0.1","TCP","66","8080  >  35800 [ACK] Seq=20 Ack=19 Win=65536 Len=0 TSval=966867133 TSecr=966867133"
"42","1.063485423","127.0.0.1","127.0.0.1","TCP","66","8080  >  35798 [ACK] Seq=152 Ack=124 Win=65536 Len=0 TSval=966867171 TSecr=966867130"
"43","2.025697665","127.0.0.1","127.0.0.1","TCP","67","35800  >  8080 [PSH, ACK] Seq=19 Ack=20 Win=65536 Len=1 TSval=966868133 TSecr=966867133 [TCP segment of a reassembled PDU]"
"44","2.025757528","127.0.0.1","127.0.0.1","TCP","66","8080  >  35800 [ACK] Seq=20 Ack=20 Win=65536 Len=0 TSval=966868133 TSecr=966868133"
"45","2.035619706","127.0.0.1","127.0.0.1","TCP","88","8080  >  35800 [PSH, ACK] Seq=20 Ack=20 Win=65536 Len=22 TSval=966868143 TSecr=966868133 [TCP segment of a reassembled PDU]"
"46","2.035632462","127.0.0.1","127.0.0.1","TCP","66","35800  >  8080 [ACK] Seq=20 Ack=42 Win=65536 Len=0 TSval=966868143 TSecr=966868143"
"47","2.035842767","127.0.0.1","127.0.0.1","TCP","74","35800  >  8080 [PSH, ACK] Seq=20 Ack=42 Win=65536 Len=8 TSval=966868144 TSecr=966868143 [TCP segment of a reassembled PDU]"
"48","2.035853459","127.0.0.1","127.0.0.1","TCP","66","8080  >  35800 [ACK] Seq=42 Ack=28 Win=65536 Len=0 TSval=966868144 TSecr=966868144"
"49","2.035934563","127.0.0.1","127.0.0.1","TCP","88","8080  >  35800 [PSH, ACK] Seq=42 Ack=28 Win=65536 Len=22 TSval=966868144 TSecr=966868144 [TCP segment of a reassembled PDU]"
"50","2.035942700","127.0.0.1","127.0.0.1","TCP","66","35800  >  8080 [ACK] Seq=28 Ack=64 Win=65536 Len=0 TSval=966868144 TSecr=966868144"
"51","2.036036814","127.0.0.1","127.0.0.1","TCP","74","35800  >  8080 [PSH, ACK] Seq=28 Ack=64 Win=65536 Len=8 TSval=966868144 TSecr=966868144 [TCP segment of a reassembled PDU]"
"52","2.036044038","127.0.0.1","127.0.0.1","TCP","66","8080  >  35800 [ACK] Seq=64 Ack=36 Win=65536 Len=0 TSval=966868144 TSecr=966868144"
"53","2.036208591","127.0.0.1","127.0.0.1","TCP","82","8080  >  35800 [PSH, ACK] Seq=64 Ack=36 Win=65536 Len=16 TSval=966868144 TSecr=966868144 [TCP segment of a reassembled PDU]"
"54","2.036219137","127.0.0.1","127.0.0.1","TCP","66","35800  >  8080 [ACK] Seq=36 Ack=80 Win=65536 Len=0 TSval=966868144 TSecr=966868144"
"55","2.036453359","127.0.0.1","127.0.0.1","TCP","74","35800  >  8080 [PSH, ACK] Seq=36 Ack=80 Win=65536 Len=8 TSval=966868144 TSecr=966868144 [TCP segment of a reassembled PDU]"
"56","2.036463779","127.0.0.1","127.0.0.1","TCP","66","8080  >  35800 [ACK] Seq=80 Ack=44 Win=65536 Len=0 TSval=966868144 TSecr=966868144"
"57","2.036571835","127.0.0.1","127.0.0.1","TCP","89","8080  >  35800 [PSH, ACK] Seq=80 Ack=44 Win=65536 Len=23 TSval=966868144 TSecr=966868144 [TCP segment of a reassembled PDU]"
"58","2.036577900","127.0.0.1","127.0.0.1","TCP","66","35800  >  8080 [ACK] Seq=44 Ack=103 Win=65536 Len=0 TSval=966868144 TSecr=966868144"
"59","2.036712300","127.0.0.1","127.0.0.1","TCP","74","35800  >  8080 [PSH, ACK] Seq=44 Ack=103 Win=65536 Len=8 TSval=966868144 TSecr=966868144 [TCP segment of a reassembled PDU]"
"60","2.036722320","127.0.0.1","127.0.0.1","TCP","66","8080  >  35800 [ACK] Seq=103 Ack=52 Win=65536 Len=0 TSval=966868144 TSecr=966868144"
"61","2.036829431","127.0.0.1","127.0.0.1","TCP","92","8080  >  35800 [PSH, ACK] Seq=103 Ack=52 Win=65536 Len=26 TSval=966868145 TSecr=966868144 [TCP segment of a reassembled PDU]"
"62","2.036835500","127.0.0.1","127.0.0.1","TCP","66","35800  >  8080 [ACK] Seq=52 Ack=129 Win=65536 Len=0 TSval=966868145 TSecr=966868145"
"63","2.036878369","127.0.0.1","127.0.0.1","TCP","74","35800  >  8080 [PSH, ACK] Seq=52 Ack=129 Win=65536 Len=8 TSval=966868145 TSecr=966868145 [TCP segment of a reassembled PDU]"
"64","2.039186428","127.0.0.1","127.0.0.1","TCP","66","8080  >  35800 [ACK] Seq=129 Ack=60 Win=65536 Len=0 TSval=966868147 TSecr=966868145"
"65","2.046885531","127.0.0.1","127.0.0.1","TCP","129","35800  >  8080 [PSH, ACK] Seq=60 Ack=129 Win=65536 Len=63 TSval=966868155 TSecr=966868147"
"66","2.046900968","127.0.0.1","127.0.0.1","TCP","66","8080  >  35800 [ACK] Seq=129 Ack=123 Win=65536 Len=0 TSval=966868155 TSecr=966868155"
"67","2.047104897","127.0.0.1","127.0.0.1","TCP","89","8080  >  35800 [PSH, ACK] Seq=129 Ack=123 Win=65536 Len=23 TSval=966868155 TSecr=966868155 [TCP segment of a reassembled PDU]"
"68","2.047116183","127.0.0.1","127.0.0.1","TCP","66","35800  >  8080 [ACK] Seq=123 Ack=152 Win=65536 Len=0 TSval=966868155 TSecr=966868155"
"69","2.047753878","127.0.0.1","127.0.0.1","TCP","66","35800  >  8080 [FIN, ACK] Seq=123 Ack=152 Win=65536 Len=0 TSval=966868155 TSecr=966868155"
"70","2.049706706","127.0.0.1","127.0.0.1","TCP","74","35802  >  8080 [SYN] Seq=0 Win=65495 Len=0 MSS=65495 SACK_PERM=1 TSval=966868157 TSecr=0 WS=128"
"71","2.049717383","127.0.0.1","127.0.0.1","TCP","74","8080  >  35802 [SYN, ACK] Seq=0 Ack=1 Win=65483 Len=0 MSS=65495 SACK_PERM=1 TSval=966868157 TSecr=966868157 WS=128"
"72","2.049726927","127.0.0.1","127.0.0.1","TCP","66","35802  >  8080 [ACK] Seq=1 Ack=1 Win=65536 Len=0 TSval=966868157 TSecr=966868157"
"73","2.049862732","127.0.0.1","127.0.0.1","TCP","85","8080  >  35802 [PSH, ACK] Seq=1 Ack=1 Win=65536 Len=19 TSval=966868158 TSecr=966868157 [TCP segment of a reassembled PDU]"
"74","2.049889588","127.0.0.1","127.0.0.1","TCP","66","35802  >  8080 [ACK] Seq=1 Ack=20 Win=65536 Len=0 TSval=966868158 TSecr=966868158"
"75","2.050057819","127.0.0.1","127.0.0.1","TCP","84","35802  >  8080 [PSH, ACK] Seq=1 Ack=20 Win=65536 Len=18 TSval=966868158 TSecr=966868158 [TCP segment of a reassembled PDU]"
"76","2.050063306","127.0.0.1","127.0.0.1","TCP","66","8080  >  35802 [ACK] Seq=20 Ack=19 Win=65536 Len=0 TSval=966868158 TSecr=966868158"
"77","2.091432303","127.0.0.1","127.0.0.1","TCP","66","8080  >  35800 [ACK] Seq=152 Ack=124 Win=65536 Len=0 TSval=966868199 TSecr=966868155"
"78","3.050526234","127.0.0.1","127.0.0.1","TCP","67","35802  >  8080 [PSH, ACK] Seq=19 Ack=20 Win=65536 Len=1 TSval=966869158 TSecr=966868158 [TCP segment of a reassembled PDU]"
"79","3.050590354","127.0.0.1","127.0.0.1","TCP","66","8080  >  35802 [ACK] Seq=20 Ack=20 Win=65536 Len=0 TSval=966869158 TSecr=966869158"
"80","3.060861614","127.0.0.1","127.0.0.1","TCP","88","8080  >  35802 [PSH, ACK] Seq=20 Ack=20 Win=65536 Len=22 TSval=966869169 TSecr=966869158 [TCP segment of a reassembled PDU]"
"81","3.060874948","127.0.0.1","127.0.0.1","TCP","66","35802  >  8080 [ACK] Seq=20 Ack=42 Win=65536 Len=0 TSval=966869169 TSecr=966869169"
"82","3.061075058","127.0.0.1","127.0.0.1","TCP","74","35802  >  8080 [PSH, ACK] Seq=20 Ack=42 Win=65536 Len=8 TSval=966869169 TSecr=966869169 [TCP segment of a reassembled PDU]"
"83","3.061085638","127.0.0.1","127.0.0.1","TCP","66","8080  >  35802 [ACK] Seq=42 Ack=28 Win=65536 Len=0 TSval=966869169 TSecr=966869169"
"84","3.061160391","127.0.0.1","127.0.0.1","TCP","88","8080  >  35802 [PSH, ACK] Seq=42 Ack=28 Win=65536 Len=22 TSval=966869169 TSecr=966869169 [TCP segment of a reassembled PDU]"
"85","3.061167809","127.0.0.1","127.0.0.1","TCP","66","35802  >  8080 [ACK] Seq=28 Ack=64 Win=65536 Len=0 TSval=966869169 TSecr=966869169"
"86","3.061222872","127.0.0.1","127.0.0.1","TCP","74","35802  >  8080 [PSH, ACK] Seq=28 Ack=64 Win=65536 Len=8 TSval=966869169 TSecr=966869169 [TCP segment of a reassembled PDU]"
"87","3.061240628","127.0.0.1","127.0.0.1","TCP","66","8080  >  35802 [ACK] Seq=64 Ack=36 Win=65536 Len=0 TSval=966869169 TSecr=966869169"
"88","3.061314513","127.0.0.1","127.0.0.1","TCP","82","8080  >  35802 [PSH, ACK] Seq=64 Ack=36 Win=65536 Len=16 TSval=966869169 TSecr=966869169 [TCP segment of a reassembled PDU]"
"89","3.061319881","127.0.0.1","127.0.0.1","TCP","66","35802  >  8080 [ACK] Seq=36 Ack=80 Win=65536 Len=0 TSval=966869169 TSecr=966869169"
"90","3.061393817","127.0.0.1","127.0.0.1","TCP","74","35802  >  8080 [PSH, ACK] Seq=36 Ack=80 Win=65536 Len=8 TSval=966869169 TSecr=966869169 [TCP segment of a reassembled PDU]"
"91","3.061413182","127.0.0.1","127.0.0.1","TCP","66","8080  >  35802 [ACK] Seq=80 Ack=44 Win=65536 Len=0 TSval=966869169 TSecr=966869169"
"92","3.061482216","127.0.0.1","127.0.0.1","TCP","89","8080  >  35802 [PSH, ACK] Seq=80 Ack=44 Win=65536 Len=23 TSval=966869169 TSecr=966869169 [TCP segment of a reassembled PDU]"
"93","3.061487220","127.0.0.1","127.0.0.1","TCP","66","35802  >  8080 [ACK] Seq=44 Ack=103 Win=65536 Len=0 TSval=966869169 TSecr=966869169"
"94","3.061560869","127.0.0.1","127.0.0.1","TCP","74","35802  >  8080 [PSH, ACK] Seq=44 Ack=103 Win=65536 Len=8 TSval=966869169 TSecr=966869169 [TCP segment of a reassembled PDU]"
"95","3.061579833","127.0.0.1","127.0.0.1","TCP","66","8080  >  35802 [ACK] Seq=103 Ack=52 Win=65536 Len=0 TSval=966869169 TSecr=966869169"
"96","3.061614300","127.0.0.1","127.0.0.1","TCP","92","8080  >  35802 [PSH, ACK] Seq=103 Ack=52 Win=65536 Len=26 TSval=966869169 TSecr=966869169 [TCP segment of a reassembled PDU]"
"97","3.061618324","127.0.0.1","127.0.0.1","TCP","66","35802  >  8080 [ACK] Seq=52 Ack=129 Win=65536 Len=0 TSval=966869169 TSecr=966869169"
"98","3.061647487","127.0.0.1","127.0.0.1","TCP","74","35802  >  8080 [PSH, ACK] Seq=52 Ack=129 Win=65536 Len=8 TSval=966869169 TSecr=966869169 [TCP segment of a reassembled PDU]"
"99","3.063549769","127.0.0.1","127.0.0.1","TCP","66","8080  >  35802 [ACK] Seq=129 Ack=60 Win=65536 Len=0 TSval=966869171 TSecr=966869169"
"100","3.070826006","127.0.0.1","127.0.0.1","TCP","129","35802  >  8080 [PSH, ACK] Seq=60 Ack=129 Win=65536 Len=63 TSval=966869179 TSecr=966869171"
"101","3.070834977","127.0.0.1","127.0.0.1","TCP","66","8080  >  35802 [ACK] Seq=129 Ack=123 Win=65536 Len=0 TSval=966869179 TSecr=966869179"
"102","3.070904650","127.0.0.1","127.0.0.1","TCP","89","8080  >  35802 [PSH, ACK] Seq=129 Ack=123 Win=65536 Len=23 TSval=966869179 TSecr=966869179 [TCP segment of a reassembled PDU]"
"103","3.070958432","127.0.0.1","127.0.0.1","TCP","66","35802  >  8080 [ACK] Seq=123 Ack=152 Win=65536 Len=0 TSval=966869179 TSecr=966869179"
"104","3.071131224","127.0.0.1","127.0.0.1","TCP","66","35802  >  8080 [FIN, ACK] Seq=123 Ack=152 Win=65536 Len=0 TSval=966869179 TSecr=966869179"
"105","3.072280741","127.0.0.1","127.0.0.1","TCP","74","35804  >  8080 [SYN] Seq=0 Win=65495 Len=0 MSS=65495 SACK_PERM=1 TSval=966869180 TSecr=0 WS=128"
"106","3.072291907","127.0.0.1","127.0.0.1","TCP","74","8080  >  35804 [SYN, ACK] Seq=0 Ack=1 Win=65483 Len=0 MSS=65495 SACK_PERM=1 TSval=966869180 TSecr=966869180 WS=128"
"107","3.072302705","127.0.0.1","127.0.0.1","TCP","66","35804  >  8080 [ACK] Seq=1 Ack=1 Win=65536 Len=0 TSval=966869180 TSecr=966869180"
"108","3.072422699","127.0.0.1","127.0.0.1","TCP","85","8080  >  35804 [PSH, ACK] Seq=1 Ack=1 Win=65536 Len=19 TSval=966869180 TSecr=966869180 [TCP segment of a reassembled PDU]"
"109","3.072460326","127.0.0.1","127.0.0.1","TCP","66","35804  >  8080 [ACK] Seq=1 Ack=20 Win=65536 Len=0 TSval=966869180 TSecr=966869180"
"110","3.072658548","127.0.0.1","127.0.0.1","TCP","84","35804  >  8080 [PSH, ACK] Seq=1 Ack=20 Win=65536 Len=18 TSval=966869180 TSecr=966869180 [TCP segment of a reassembled PDU]"
"111","3.072665109","127.0.0.1","127.0.0.1","TCP","66","8080  >  35804 [ACK] Seq=20 Ack=19 Win=65536 Len=0 TSval=966869180 TSecr=966869180"
"112","3.111760324","127.0.0.1","127.0.0.1","TCP","66","8080  >  35802 [ACK] Seq=152 Ack=124 Win=65536 Len=0 TSval=966869219 TSecr=966869179"
"113","4.072939518","127.0.0.1","127.0.0.1","TCP","67","35804  >  8080 [PSH, ACK] Seq=19 Ack=20 Win=65536 Len=1 TSval=966870181 TSecr=966869180 [TCP segment of a reassembled PDU]"
"114","4.072971739","127.0.0.1","127.0.0.1","TCP","66","8080  >  35804 [ACK] Seq=20 Ack=20 Win=65536 Len=0 TSval=966870181 TSecr=966870181"
"115","4.077727943","127.0.0.1","127.0.0.1","TCP","88","8080  >  35804 [PSH, ACK] Seq=20 Ack=20 Win=65536 Len=22 TSval=966870185 TSecr=966870181 [TCP segment of a reassembled PDU]"
"116","4.077737970","127.0.0.1","127.0.0.1","TCP","66","35804  >  8080 [ACK] Seq=20 Ack=42 Win=65536 Len=0 TSval=966870185 TSecr=966870185"
"117","4.077836345","127.0.0.1","127.0.0.1","TCP","74","35804  >  8080 [PSH, ACK] Seq=20 Ack=42 Win=65536 Len=8 TSval=966870186 TSecr=966870185 [TCP segment of a reassembled PDU]"
"118","4.077841185","127.0.0.1","127.0.0.1","TCP","66","8080  >  35804 [ACK] Seq=42 Ack=28 Win=65536 Len=0 TSval=966870186 TSecr=966870186"
"119","4.077879064","127.0.0.1","127.0.0.1","TCP","88","8080  >  35804 [PSH, ACK] Seq=42 Ack=28 Win=65536 Len=22 TSval=966870186 TSecr=966870186 [TCP segment of a reassembled PDU]"
"120","4.077882407","127.0.0.1","127.0.0.1","TCP","66","35804  >  8080 [ACK] Seq=28 Ack=64 Win=65536 Len=0 TSval=966870186 TSecr=966870186"
"121","4.077907099","127.0.0.1","127.0.0.1","TCP","74","35804  >  8080 [PSH, ACK] Seq=28 Ack=64 Win=65536 Len=8 TSval=966870186 TSecr=966870186 [TCP segment of a reassembled PDU]"
"122","4.077931341","127.0.0.1","127.0.0.1","TCP","66","8080  >  35804 [ACK] Seq=64 Ack=36 Win=65536 Len=0 TSval=966870186 TSecr=966870186"
"123","4.077964432","127.0.0.1","127.0.0.1","TCP","82","8080  >  35804 [PSH, ACK] Seq=64 Ack=36 Win=65536 Len=16 TSval=966870186 TSecr=966870186 [TCP segment of a reassembled PDU]"
"124","4.077966771","127.0.0.1","127.0.0.1","TCP","66","35804  >  8080 [ACK] Seq=36 Ack=80 Win=65536 Len=0 TSval=966870186 TSecr=966870186"
"125","4.077996036","127.0.0.1","127.0.0.1","TCP","74","35804  >  8080 [PSH, ACK] Seq=36 Ack=80 Win=65536 Len=8 TSval=966870186 TSecr=966870186 [TCP segment of a reassembled PDU]"
"126","4.077999219","127.0.0.1","127.0.0.1","TCP","66","8080  >  35804 [ACK] Seq=80 Ack=44 Win=65536 Len=0 TSval=966870186 TSecr=966870186"
"127","4.078026052","127.0.0.1","127.0.0.1","TCP","89","8080  >  35804 [PSH, ACK] Seq=80 Ack=44 Win=65536 Len=23 TSval=966870186 TSecr=966870186 [TCP segment of a reassembled PDU]"
"128","4.078028873","127.0.0.1","127.0.0.1","TCP","66","35804  >  8080 [ACK] Seq=44 Ack=103 Win=65536 Len=0 TSval=966870186 TSecr=966870186"
"129","4.078096591","127.0.0.1","127.0.0.1","TCP","74","35804  >  8080 [PSH, ACK] Seq=44 Ack=103 Win=65536 Len=8 TSval=966870186 TSecr=966870186 [TCP segment of a reassembled PDU]"
"130","4.078101449","127.0.0.1","127.0.0.1","TCP","66","8080  >  35804 [ACK] Seq=103 Ack=52 Win=65536 Len=0 TSval=966870186 TSecr=966870186"
"131","4.078171851","127.0.0.1","127.0.0.1","TCP","92","8080  >  35804 [PSH, ACK] Seq=103 Ack=52 Win=65536 Len=26 TSval=966870186 TSecr=966870186 [TCP segment of a reassembled PDU]"
"132","4.078174882","127.0.0.1","127.0.0.1","TCP","66","35804  >  8080 [ACK] Seq=52 Ack=129 Win=65536 Len=0 TSval=966870186 TSecr=966870186"
"133","4.078213673","127.0.0.1","127.0.0.1","TCP","74","35804  >  8080 [PSH, ACK] Seq=52 Ack=129 Win=65536 Len=8 TSval=966870186 TSecr=966870186 [TCP segment of a reassembled PDU]"
"134","4.078216115","127.0.0.1","127.0.0.1","TCP","66","8080  >  35804 [ACK] Seq=129 Ack=60 Win=65536 Len=0 TSval=966870186 TSecr=966870186"
"135","4.082920480","127.0.0.1","127.0.0.1","TCP","129","35804  >  8080 [PSH, ACK] Seq=60 Ack=129 Win=65536 Len=63 TSval=966870191 TSecr=966870186"
"136","4.082928755","127.0.0.1","127.0.0.1","TCP","66","8080  >  35804 [ACK] Seq=129 Ack=123 Win=65536 Len=0 TSval=966870191 TSecr=966870191"
"137","4.083076372","127.0.0.1","127.0.0.1","TCP","89","8080  >  35804 [PSH, ACK] Seq=129 Ack=123 Win=65536 Len=23 TSval=966870191 TSecr=966870191 [TCP segment of a reassembled PDU]"
"138","4.083081101","127.0.0.1","127.0.0.1","TCP","66","35804  >  8080 [ACK] Seq=123 Ack=152 Win=65536 Len=0 TSval=966870191 TSecr=966870191"
"139","4.083262207","127.0.0.1","127.0.0.1","TCP","66","35804  >  8080 [FIN, ACK] Seq=123 Ack=152 Win=65536 Len=0 TSval=966870191 TSecr=966870191"
"140","4.084054756","127.0.0.1","127.0.0.1","TCP","74","35806  >  8080 [SYN] Seq=0 Win=65495 Len=0 MSS=65495 SACK_PERM=1 TSval=966870192 TSecr=0 WS=128"
"141","4.084063224","127.0.0.1","127.0.0.1","TCP","74","8080  >  35806 [SYN, ACK] Seq=0 Ack=1 Win=65483 Len=0 MSS=65495 SACK_PERM=1 TSval=966870192 TSecr=966870192 WS=128"
"142","4.084070944","127.0.0.1","127.0.0.1","TCP","66","35806  >  8080 [ACK] Seq=1 Ack=1 Win=65536 Len=0 TSval=966870192 TSecr=966870192"
"143","4.084164752","127.0.0.1","127.0.0.1","TCP","85","8080  >  35806 [PSH, ACK] Seq=1 Ack=1 Win=65536 Len=19 TSval=966870192 TSecr=966870192 [TCP segment of a reassembled PDU]"
"144","4.084192023","127.0.0.1","127.0.0.1","TCP","66","35806  >  8080 [ACK] Seq=1 Ack=20 Win=65536 Len=0 TSval=966870192 TSecr=966870192"
"145","4.084303135","127.0.0.1","127.0.0.1","TCP","84","35806  >  8080 [PSH, ACK] Seq=1 Ack=20 Win=65536 Len=18 TSval=966870192 TSecr=966870192 [TCP segment of a reassembled PDU]"
"146","4.084306980","127.0.0.1","127.0.0.1","TCP","66","8080  >  35806 [ACK] Seq=20 Ack=19 Win=65536 Len=0 TSval=966870192 TSecr=966870192"
"147","4.128077773","127.0.0.1","127.0.0.1","TCP","66","8080  >  35804 [ACK] Seq=152 Ack=124 Win=65536 Len=0 TSval=966870236 TSecr=966870191"
"148","5.085039900","127.0.0.1","127.0.0.1","TCP","67","35806  >  8080 [PSH, ACK] Seq=19 Ack=20 Win=65536 Len=1 TSval=966871193 TSecr=966870192 [TCP segment of a reassembled PDU]"
"149","5.085106755","127.0.0.1","127.0.0.1","TCP","66","8080  >  35806 [ACK] Seq=20 Ack=20 Win=65536 Len=0 TSval=966871193 TSecr=966871193"
"150","5.095047707","127.0.0.1","127.0.0.1","TCP","88","8080  >  35806 [PSH, ACK] Seq=20 Ack=20 Win=65536 Len=22 TSval=966871203 TSecr=966871193 [TCP segment of a reassembled PDU]"
"151","5.095061287","127.0.0.1","127.0.0.1","TCP","66","35806  >  8080 [ACK] Seq=20 Ack=42 Win=65536 Len=0 TSval=966871203 TSecr=966871203"
"152","5.095293750","127.0.0.1","127.0.0.1","TCP","74","35806  >  8080 [PSH, ACK] Seq=20 Ack=42 Win=65536 Len=8 TSval=966871203 TSecr=966871203 [TCP segment of a reassembled PDU]"
"153","5.095304408","127.0.0.1","127.0.0.1","TCP","66","8080  >  35806 [ACK] Seq=42 Ack=28 Win=65536 Len=0 TSval=966871203 TSecr=966871203"
"154","5.095376283","127.0.0.1","127.0.0.1","TCP","88","8080  >  35806 [PSH, ACK] Seq=42 Ack=28 Win=65536 Len=22 TSval=966871203 TSecr=966871203 [TCP segment of a reassembled PDU]"
"155","5.095381986","127.0.0.1","127.0.0.1","TCP","66","35806  >  8080 [ACK] Seq=28 Ack=64 Win=65536 Len=0 TSval=966871203 TSecr=966871203"
"156","5.095512858","127.0.0.1","127.0.0.1","TCP","74","35806  >  8080 [PSH, ACK] Seq=28 Ack=64 Win=65536 Len=8 TSval=966871203 TSecr=966871203 [TCP segment of a reassembled PDU]"
"157","5.095523438","127.0.0.1","127.0.0.1","TCP","66","8080  >  35806 [ACK] Seq=64 Ack=36 Win=65536 Len=0 TSval=966871203 TSecr=966871203"
"158","5.095674714","127.0.0.1","127.0.0.1","TCP","82","8080  >  35806 [PSH, ACK] Seq=64 Ack=36 Win=65536 Len=16 TSval=966871203 TSecr=966871203 [TCP segment of a reassembled PDU]"
"159","5.095682085","127.0.0.1","127.0.0.1","TCP","66","35806  >  8080 [ACK] Seq=36 Ack=80 Win=65536 Len=0 TSval=966871203 TSecr=966871203"
"160","5.095801347","127.0.0.1","127.0.0.1","TCP","74","35806  >  8080 [PSH, ACK] Seq=36 Ack=80 Win=65536 Len=8 TSval=966871204 TSecr=966871203 [TCP segment of a reassembled PDU]"
"161","5.095807142","127.0.0.1","127.0.0.1","TCP","66","8080  >  35806 [ACK] Seq=80 Ack=44 Win=65536 Len=0 TSval=966871204 TSecr=966871204"
"162","5.095860430","127.0.0.1","127.0.0.1","TCP","89","8080  >  35806 [PSH, ACK] Seq=80 Ack=44 Win=65536 Len=23 TSval=966871204 TSecr=966871204 [TCP segment of a reassembled PDU]"
"163","5.095865415","127.0.0.1","127.0.0.1","TCP","66","35806  >  8080 [ACK] Seq=44 Ack=103 Win=65536 Len=0 TSval=966871204 TSecr=966871204"
"164","5.095902754","127.0.0.1","127.0.0.1","TCP","74","35806  >  8080 [PSH, ACK] Seq=44 Ack=103 Win=65536 Len=8 TSval=966871204 TSecr=966871204 [TCP segment of a reassembled PDU]"
"165","5.095906912","127.0.0.1","127.0.0.1","TCP","66","8080  >  35806 [ACK] Seq=103 Ack=52 Win=65536 Len=0 TSval=966871204 TSecr=966871204"
"166","5.095941158","127.0.0.1","127.0.0.1","TCP","92","8080  >  35806 [PSH, ACK] Seq=103 Ack=52 Win=65536 Len=26 TSval=966871204 TSecr=966871204 [TCP segment of a reassembled PDU]"
"167","5.095945064","127.0.0.1","127.0.0.1","TCP","66","35806  >  8080 [ACK] Seq=52 Ack=129 Win=65536 Len=0 TSval=966871204 TSecr=966871204"
"168","5.096061407","127.0.0.1","127.0.0.1","TCP","74","35806  >  8080 [PSH, ACK] Seq=52 Ack=129 Win=65536 Len=8 TSval=966871204 TSecr=966871204 [TCP segment of a reassembled PDU]"
"169","5.096069632","127.0.0.1","127.0.0.1","TCP","66","8080  >  35806 [ACK] Seq=129 Ack=60 Win=65536 Len=0 TSval=966871204 TSecr=966871204"
"170","5.106730694","127.0.0.1","127.0.0.1","TCP","129","35806  >  8080 [PSH, ACK] Seq=60 Ack=129 Win=65536 Len=63 TSval=966871214 TSecr=966871204"
"171","5.106744549","127.0.0.1","127.0.0.1","TCP","66","8080  >  35806 [ACK] Seq=129 Ack=123 Win=65536 Len=0 TSval=966871214 TSecr=966871214"
"172","5.106946741","127.0.0.1","127.0.0.1","TCP","89","8080  >  35806 [PSH, ACK] Seq=129 Ack=123 Win=65536 Len=23 TSval=966871215 TSecr=966871214 [TCP segment of a reassembled PDU]"
"173","5.106958190","127.0.0.1","127.0.0.1","TCP","66","35806  >  8080 [ACK] Seq=123 Ack=152 Win=65536 Len=0 TSval=966871215 TSecr=966871215"
"174","5.107510327","127.0.0.1","127.0.0.1","TCP","66","35806  >  8080 [FIN, ACK] Seq=123 Ack=152 Win=65536 Len=0 TSval=966871215 TSecr=966871215"
"175","5.109343011","127.0.0.1","127.0.0.1","TCP","74","35808  >  8080 [SYN] Seq=0 Win=65495 Len=0 MSS=65495 SACK_PERM=1 TSval=966871217 TSecr=0 WS=128"
"176","5.109353830","127.0.0.1","127.0.0.1","TCP","74","8080  >  35808 [SYN, ACK] Seq=0 Ack=1 Win=65483 Len=0 MSS=65495 SACK_PERM=1 TSval=966871217 TSecr=966871217 WS=128"
"177","5.109364088","127.0.0.1","127.0.0.1","TCP","66","35808  >  8080 [ACK] Seq=1 Ack=1 Win=65536 Len=0 TSval=966871217 TSecr=966871217"
"178","5.109486468","127.0.0.1","127.0.0.1","TCP","85","8080  >  35808 [PSH, ACK] Seq=1 Ack=1 Win=65536 Len=19 TSval=966871217 TSecr=966871217 [TCP segment of a reassembled PDU]"
"179","5.109522236","127.0.0.1","127.0.0.1","TCP","66","35808  >  8080 [ACK] Seq=1 Ack=20 Win=65536 Len=0 TSval=966871217 TSecr=966871217"
"180","5.109708650","127.0.0.1","127.0.0.1","TCP","84","35808  >  8080 [PSH, ACK] Seq=1 Ack=20 Win=65536 Len=18 TSval=966871217 TSecr=966871217 [TCP segment of a reassembled PDU]"
"181","5.109714675","127.0.0.1","127.0.0.1","TCP","66","8080  >  35808 [ACK] Seq=20 Ack=19 Win=65536 Len=0 TSval=966871217 TSecr=966871217"
"182","5.152133440","127.0.0.1","127.0.0.1","TCP","66","8080  >  35806 [ACK] Seq=152 Ack=124 Win=65536 Len=0 TSval=966871260 TSecr=966871215"
"183","6.110258596","127.0.0.1","127.0.0.1","TCP","67","35808  >  8080 [PSH, ACK] Seq=19 Ack=20 Win=65536 Len=1 TSval=966872218 TSecr=966871217 [TCP segment of a reassembled PDU]"
"184","6.110326972","127.0.0.1","127.0.0.1","TCP","66","8080  >  35808 [ACK] Seq=20 Ack=20 Win=65536 Len=0 TSval=966872218 TSecr=966872218"
"185","6.120499584","127.0.0.1","127.0.0.1","TCP","88","8080  >  35808 [PSH, ACK] Seq=20 Ack=20 Win=65536 Len=22 TSval=966872228 TSecr=966872218 [TCP segment of a reassembled PDU]"
"186","6.120513750","127.0.0.1","127.0.0.1","TCP","66","35808  >  8080 [ACK] Seq=20 Ack=42 Win=65536 Len=0 TSval=966872228 TSecr=966872228"
"187","6.120635575","127.0.0.1","127.0.0.1","TCP","74","35808  >  8080 [PSH, ACK] Seq=20 Ack=42 Win=65536 Len=8 TSval=966872228 TSecr=966872228 [TCP segment of a reassembled PDU]"
"188","6.120663176","127.0.0.1","127.0.0.1","TCP","66","8080  >  35808 [ACK] Seq=42 Ack=28 Win=65536 Len=0 TSval=966872228 TSecr=966872228"
"189","6.120739095","127.0.0.1","127.0.0.1","TCP","88","8080  >  35808 [PSH, ACK] Seq=42 Ack=28 Win=65536 Len=22 TSval=966872228 TSecr=966872228 [TCP segment of a reassembled PDU]"
"190","6.120744249","127.0.0.1","127.0.0.1","TCP","66","35808  >  8080 [ACK] Seq=28 Ack=64 Win=65536 Len=0 TSval=966872228 TSecr=966872228"
"191","6.120878381","127.0.0.1","127.0.0.1","TCP","74","35808  >  8080 [PSH, ACK] Seq=28 Ack=64 Win=65536 Len=8 TSval=966872229 TSecr=966872228 [TCP segment of a reassembled PDU]"
"192","6.120888602","127.0.0.1","127.0.0.1","TCP","66","8080  >  35808 [ACK] Seq=64 Ack=36 Win=65536 Len=0 TSval=966872229 TSecr=966872229"
"193","6.121031458","127.0.0.1","127.0.0.1","TCP","82","8080  >  35808 [PSH, ACK] Seq=64 Ack=36 Win=65536 Len=16 TSval=966872229 TSecr=966872229 [TCP segment of a reassembled PDU]"
"194","6.121039413","127.0.0.1","127.0.0.1","TCP","66","35808  >  8080 [ACK] Seq=36 Ack=80 Win=65536 Len=0 TSval=966872229 TSecr=966872229"
"195","6.121085756","127.0.0.1","127.0.0.1","TCP","74","35808  >  8080 [PSH, ACK] Seq=36 Ack=80 Win=65536 Len=8 TSval=966872229 TSecr=966872229 [TCP segment of a reassembled PDU]"
"196","6.121102818","127.0.0.1","127.0.0.1","TCP","66","8080  >  35808 [ACK] Seq=80 Ack=44 Win=65536 Len=0 TSval=966872229 TSecr=966872229"
"197","6.121124897","127.0.0.1","127.0.0.1","TCP","89","8080  >  35808 [PSH, ACK] Seq=80 Ack=44 Win=65536 Len=23 TSval=966872229 TSecr=966872229 [TCP segment of a reassembled PDU]"
"198","6.121128597","127.0.0.1","127.0.0.1","TCP","66","35808  >  8080 [ACK] Seq=44 Ack=103 Win=65536 Len=0 TSval=966872229 TSecr=966872229"
"199","6.121151793","127.0.0.1","127.0.0.1","TCP","74","35808  >  8080 [PSH, ACK] Seq=44 Ack=103 Win=65536 Len=8 TSval=966872229 TSecr=966872229 [TCP segment of a reassembled PDU]"
"200","6.121163672","127.0.0.1","127.0.0.1","TCP","66","8080  >  35808 [ACK] Seq=103 Ack=52 Win=65536 Len=0 TSval=966872229 TSecr=966872229"
"201","6.121182227","127.0.0.1","127.0.0.1","TCP","92","8080  >  35808 [PSH, ACK] Seq=103 Ack=52 Win=65536 Len=26 TSval=966872229 TSecr=966872229 [TCP segment of a reassembled PDU]"
"202","6.121185835","127.0.0.1","127.0.0.1","TCP","66","35808  >  8080 [ACK] Seq=52 Ack=129 Win=65536 Len=0 TSval=966872229 TSecr=966872229"
"203","6.121252899","127.0.0.1","127.0.0.1","TCP","74","35808  >  8080 [PSH, ACK] Seq=52 Ack=129 Win=65536 Len=8 TSval=966872229 TSecr=966872229 [TCP segment of a reassembled PDU]"
"204","6.122613133","127.0.0.1","127.0.0.1","TCP","66","8080  >  35808 [ACK] Seq=129 Ack=60 Win=65536 Len=0 TSval=966872230 TSecr=966872229"
"205","6.130657965","127.0.0.1","127.0.0.1","TCP","129","35808  >  8080 [PSH, ACK] Seq=60 Ack=129 Win=65536 Len=63 TSval=966872238 TSecr=966872230"
"206","6.130665746","127.0.0.1","127.0.0.1","TCP","66","8080  >  35808 [ACK] Seq=129 Ack=123 Win=65536 Len=0 TSval=966872238 TSecr=966872238"
"207","6.130793781","127.0.0.1","127.0.0.1","TCP","89","8080  >  35808 [PSH, ACK] Seq=129 Ack=123 Win=65536 Len=23 TSval=966872238 TSecr=966872238 [TCP segment of a reassembled PDU]"
"208","6.130800102","127.0.0.1","127.0.0.1","TCP","66","35808  >  8080 [ACK] Seq=123 Ack=152 Win=65536 Len=0 TSval=966872239 TSecr=966872238"
"209","6.131056719","127.0.0.1","127.0.0.1","TCP","66","35808  >  8080 [FIN, ACK] Seq=123 Ack=152 Win=65536 Len=0 TSval=966872239 TSecr=966872238"
"210","6.132099894","127.0.0.1","127.0.0.1","TCP","74","35810  >  8080 [SYN] Seq=0 Win=65495 Len=0 MSS=65495 SACK_PERM=1 TSval=966872240 TSecr=0 WS=128"
"211","6.132110209","127.0.0.1","127.0.0.1","TCP","74","8080  >  35810 [SYN, ACK] Seq=0 Ack=1 Win=65483 Len=0 MSS=65495 SACK_PERM=1 TSval=966872240 TSecr=966872240 WS=128"
"212","6.132119897","127.0.0.1","127.0.0.1","TCP","66","35810  >  8080 [ACK] Seq=1 Ack=1 Win=65536 Len=0 TSval=966872240 TSecr=966872240"
"213","6.132236400","127.0.0.1","127.0.0.1","TCP","85","8080  >  35810 [PSH, ACK] Seq=1 Ack=1 Win=65536 Len=19 TSval=966872240 TSecr=966872240 [TCP segment of a reassembled PDU]"
"214","6.132272121","127.0.0.1","127.0.0.1","TCP","66","35810  >  8080 [ACK] Seq=1 Ack=20 Win=65536 Len=0 TSval=966872240 TSecr=966872240"
"215","6.132490596","127.0.0.1","127.0.0.1","TCP","84","35810  >  8080 [PSH, ACK] Seq=1 Ack=20 Win=65536 Len=18 TSval=966872240 TSecr=966872240 [TCP segment of a reassembled PDU]"
"216","6.132496968","127.0.0.1","127.0.0.1","TCP","66","8080  >  35810 [ACK] Seq=20 Ack=19 Win=65536 Len=0 TSval=966872240 TSecr=966872240"
"217","6.171803191","127.0.0.1","127.0.0.1","TCP","66","8080  >  35808 [ACK] Seq=152 Ack=124 Win=65536 Len=0 TSval=966872279 TSecr=966872239"
"218","7.133333160","127.0.0.1","127.0.0.1","TCP","67","35810  >  8080 [PSH, ACK] Seq=19 Ack=20 Win=65536 Len=1 TSval=966873241 TSecr=966872240 [TCP segment of a reassembled PDU]"
"219","7.133398051","127.0.0.1","127.0.0.1","TCP","66","8080  >  35810 [ACK] Seq=20 Ack=20 Win=65536 Len=0 TSval=966873241 TSecr=966873241"
"220","7.143151013","127.0.0.1","127.0.0.1","TCP","88","8080  >  35810 [PSH, ACK] Seq=20 Ack=20 Win=65536 Len=22 TSval=966873251 TSecr=966873241 [TCP segment of a reassembled PDU]"
"221","7.143163912","127.0.0.1","127.0.0.1","TCP","66","35810  >  8080 [ACK] Seq=20 Ack=42 Win=65536 Len=0 TSval=966873251 TSecr=966873251"
"222","7.143369276","127.0.0.1","127.0.0.1","TCP","74","35810  >  8080 [PSH, ACK] Seq=20 Ack=42 Win=65536 Len=8 TSval=966873251 TSecr=966873251 [TCP segment of a reassembled PDU]"
"223","7.143437483","127.0.0.1","127.0.0.1","TCP","66","8080  >  35810 [ACK] Seq=42 Ack=28 Win=65536 Len=0 TSval=966873251 TSecr=966873251"
"224","7.143560159","127.0.0.1","127.0.0.1","TCP","88","8080  >  35810 [PSH, ACK] Seq=42 Ack=28 Win=65536 Len=22 TSval=966873251 TSecr=966873251 [TCP segment of a reassembled PDU]"
"225","7.143566613","127.0.0.1","127.0.0.1","TCP","66","35810  >  8080 [ACK] Seq=28 Ack=64 Win=65536 Len=0 TSval=966873251 TSecr=966873251"
"226","7.143724452","127.0.0.1","127.0.0.1","TCP","74","35810  >  8080 [PSH, ACK] Seq=28 Ack=64 Win=65536 Len=8 TSval=966873251 TSecr=966873251 [TCP segment of a reassembled PDU]"
"227","7.143734923","127.0.0.1","127.0.0.1","TCP","66","8080  >  35810 [ACK] Seq=64 Ack=36 Win=65536 Len=0 TSval=966873251 TSecr=966873251"
"228","7.143949229","127.0.0.1","127.0.0.1","TCP","82","8080  >  35810 [PSH, ACK] Seq=64 Ack=36 Win=65536 Len=16 TSval=966873252 TSecr=966873251 [TCP segment of a reassembled PDU]"
"229","7.143959329","127.0.0.1","127.0.0.1","TCP","66","35810  >  8080 [ACK] Seq=36 Ack=80 Win=65536 Len=0 TSval=966873252 TSecr=966873252"
"230","7.144063245","127.0.0.1","127.0.0.1","TCP","74","35810  >  8080 [PSH, ACK] Seq=36 Ack=80 Win=65536 Len=8 TSval=966873252 TSecr=966873252 [TCP segment of a reassembled PDU]"
"231","7.144069225","127.0.0.1","127.0.0.1","TCP","66","8080  >  35810 [ACK] Seq=80 Ack=44 Win=65536 Len=0 TSval=966873252 TSecr=966873252"
"232","7.144205949","127.0.0.1","127.0.0.1","TCP","89","8080  >  35810 [PSH, ACK] Seq=80 Ack=44 Win=65536 Len=23 TSval=966873252 TSecr=966873252 [TCP segment of a reassembled PDU]"
"233","7.144215949","127.0.0.1","127.0.0.1","TCP","66","35810  >  8080 [ACK] Seq=44 Ack=103 Win=65536 Len=0 TSval=966873252 TSecr=966873252"
"234","7.144378479","127.0.0.1","127.0.0.1","TCP","74","35810  >  8080 [PSH, ACK] Seq=44 Ack=103 Win=65536 Len=8 TSval=966873252 TSecr=966873252 [TCP segment of a reassembled PDU]"
"235","7.144388271","127.0.0.1","127.0.0.1","TCP","66","8080  >  35810 [ACK] Seq=103 Ack=52 Win=65536 Len=0 TSval=966873252 TSecr=966873252"
"236","7.144494353","127.0.0.1","127.0.0.1","TCP","92","8080  >  35810 [PSH, ACK] Seq=103 Ack=52 Win=65536 Len=26 TSval=966873252 TSecr=966873252 [TCP segment of a reassembled PDU]"
"237","7.144500436","127.0.0.1","127.0.0.1","TCP","66","35810  >  8080 [ACK] Seq=52 Ack=129 Win=65536 Len=0 TSval=966873252 TSecr=966873252"
"238","7.144550549","127.0.0.1","127.0.0.1","TCP","74","35810  >  8080 [PSH, ACK] Seq=52 Ack=129 Win=65536 Len=8 TSval=966873252 TSecr=966873252 [TCP segment of a reassembled PDU]"
"239","7.144555661","127.0.0.1","127.0.0.1","TCP","66","8080  >  35810 [ACK] Seq=129 Ack=60 Win=65536 Len=0 TSval=966873252 TSecr=966873252"
"240","7.155533936","127.0.0.1","127.0.0.1","TCP","129","35810  >  8080 [PSH, ACK] Seq=60 Ack=129 Win=65536 Len=63 TSval=966873263 TSecr=966873252"
"241","7.155548544","127.0.0.1","127.0.0.1","TCP","66","8080  >  35810 [ACK] Seq=129 Ack=123 Win=65536 Len=0 TSval=966873263 TSecr=966873263"
"242","7.155741792","127.0.0.1","127.0.0.1","TCP","89","8080  >  35810 [PSH, ACK] Seq=129 Ack=123 Win=65536 Len=23 TSval=966873263 TSecr=966873263 [TCP segment of a reassembled PDU]"
"243","7.155753949","127.0.0.1","127.0.0.1","TCP","66","35810  >  8080 [ACK] Seq=123 Ack=152 Win=65536 Len=0 TSval=966873263 TSecr=966873263"
"244","7.156073055","127.0.0.1","127.0.0.1","TCP","66","35810  >  8080 [FIN, ACK] Seq=123 Ack=152 Win=65536 Len=0 TSval=966873264 TSecr=966873263"
"245","7.157818687","127.0.0.1","127.0.0.1","TCP","74","35812  >  8080 [SYN] Seq=0 Win=65495 Len=0 MSS=65495 SACK_PERM=1 TSval=966873266 TSecr=0 WS=128"
"246","7.157836770","127.0.0.1","127.0.0.1","TCP","74","8080  >  35812 [SYN, ACK] Seq=0 Ack=1 Win=65483 Len=0 MSS=65495 SACK_PERM=1 TSval=966873266 TSecr=966873266 WS=128"
"247","7.157854023","127.0.0.1","127.0.0.1","TCP","66","35812  >  8080 [ACK] Seq=1 Ack=1 Win=65536 Len=0 TSval=966873266 TSecr=966873266"
"248","7.158049033","127.0.0.1","127.0.0.1","TCP","85","8080  >  35812 [PSH, ACK] Seq=1 Ack=1 Win=65536 Len=19 TSval=966873266 TSecr=966873266 [TCP segment of a reassembled PDU]"
"249","7.158127256","127.0.0.1","127.0.0.1","TCP","66","35812  >  8080 [ACK] Seq=1 Ack=20 Win=65536 Len=0 TSval=966873266 TSecr=966873266"
"250","7.158453213","127.0.0.1","127.0.0.1","TCP","84","35812  >  8080 [PSH, ACK] Seq=1 Ack=20 Win=65536 Len=18 TSval=966873266 TSecr=966873266 [TCP segment of a reassembled PDU]"
"251","7.158464580","127.0.0.1","127.0.0.1","TCP","66","8080  >  35812 [ACK] Seq=20 Ack=19 Win=65536 Len=0 TSval=966873266 TSecr=966873266"
"252","7.199432707","127.0.0.1","127.0.0.1","TCP","66","8080  >  35810 [ACK] Seq=152 Ack=124 Win=65536 Len=0 TSval=966873307 TSecr=966873264"
"253","8.159227830","127.0.0.1","127.0.0.1","TCP","67","35812  >  8080 [PSH, ACK] Seq=19 Ack=20 Win=65536 Len=1 TSval=966874267 TSecr=966873266 [TCP segment of a reassembled PDU]"
